comment_sen,score
"虽然服务不错，但是这款机器真的没有办法给好评，游戏方面真是太少了，但是你是游戏机啊！
流畅度：好
运行速度：好
 
画面效果：好",2
游戏不错，用来打发时间不错，挺好。新机器就是弯的，无所谓了，早晚也得弯，到时再修。不能用以前的产品价值观衡量现在的产品。,2
游戏机是被拆过的，不过疫情期间不影响使用就不折腾了。心仪已久的任天堂游戏机哝，就是健身环游戏涨价太离谱了。这样就ps4和switch都有了，游戏好贵但是在家好无聊。,3
游戏机是不错的，国行就国行吧，就是发漏了我游戏卡和内存卡，一个好好的周末计划泡了汤，虽然补发了游戏卡和内存卡，感觉不到商家和客服的诚意，这次体验感很差,2
看了网上的国行反馈，收到后就没拆，申请了退货，不能和外服联机能忍，但不能dlc不能忍，再加上游戏审核慢，已经开售两年的游戏机，现在买，想玩游戏还得等？当然，可以买卡带，但是就是没优势啊，国行没后门，也就剩下网速和保修了，和其他版本比，不香，再等等，等一个bug，实在不行，直接买其他版本了,3
机器来说还是很不错的，但有个问题，配件中的HDMI线是坏的，哎~害的我以为电视坏了。另外找了一根线换来换测试了好几遍才发现。新机一条线都是坏的，这个品控也是醉了,2
现在国行一片黑暗，后门遥遥无期，游戏过审要半年，强烈不推荐入，来自某位烈士的遗言,2
国行说真的不怎么可以，不能切换地区，游戏目前只有一个，所以说要玩其他的不能下载只能买游戏卡，也就是说基本可以不用买存储卡，反正不推荐国行,3
游戏太少了，目前只有一个能玩的，其他游戏上市时间没明确说，期待尽快有更多新游戏上线,2
"&hellip;新买的机器，刚上手玩就发现手柄有问题。。。这质量。。。换个手柄浪费7天时间。。好在问题还是解决了。
本来想打3?
?
商店新上架了一款游戏&hellip;&hellip;这游戏e**&hellip;&hellip;
再扣1?吧。。",2
外形外观：拿到手开机创建账号的那一刻，我就已经后悔了，机子是好东西，就是不能像其他版本关键任天堂账号，跨区域买游戏，这样一个游戏价格起码高好几百！多玩两个游戏又能再买一台了！哎~~现在有点痛苦，开封又不能退~~~,2
"箱也开了 膜也贴了 包也试了 然后发现没事情干了
steam那样的商店比较爽，可惜switch没有
半个小时整个主机看了个遍
马里奥也不好玩
官方膜也不错，挺好贴的
单机卡带玩家[捂脸]
我发现没有游戏商店这个，真的不习惯
等着明后天二手风花雪月了。
不知道什么时候能用ns账号",3
上当了。把玩家当傻子么，一个月就这一个游戏，糊弄谁呢，没游戏就不要发售。宝可梦剑盾dlc。。。。玩不上了。,2
关注了一段时间才决定买的，东西还是挺不错的，不仅外观好看做工也不错，玩游戏挺流畅的，还可以连接到电视上面玩。不过可惜内置一款体验版的超级玛丽，如果想要玩完整版的还需要花299元到游戏商店购买！这还不是最惨的！最惨的是，游戏商店里面仅有这一款游戏可以买！昨天ns到家已经没有什么兴趣了！！！,2
"产品包装：就是盒子上套了个京东快递的袋子，到手发现盒子表面有破损。
建议不要购买国行，首发购买一个月了国行商店只有一个马里奥兄弟，也不像ps4或者Xbox一样有转港服的手段。虽然可以玩外服卡带但是无法使用dlc，没办法完整体验游戏。我买的是游戏机，但是买回来却没有游戏玩，首发时宣传未来数周上架的游戏到了一月底官方没有一点确切消息，后悔当时相信腾讯到手拆封了。",2
"1外包装盒、2内包装隔层、3机身、4机子系统网上查的三码合一是指1+2+3回复的三码合一是指2+3+4到的机子外包装盒的编码跟其他三个不一致而且没有开机红!!!没有开机红!!!没有开机红!!！机子和配件检查看起来是新的但是没有开机红我心里不踏实会不会是翻新机?假的?快递包装极其陋我买的套镠含屏幕膜(就是像买手机膜那样的纸皮包装不是盒子)十机身的纳包(单独盒子)十机身(单独盒子),共三样东西就只是拿保鲜膜包把三样东西起来而已两千多的游戏机连一个包装盒纸盒都不配拥有吗?????",2
我也是服了任天堂的做工了，618下单送到手之后兴高采烈地准备贴膜，擦屏幕的时候一看在屏幕里面右上角有一个白点，一看就是安装的时候把灰尘带进去了，好选择换货，好不容易26号换好了，拿回来仔细一看，新换的一台也有！而且还没上台好，这一次灰尘是在正中间！网上有人吐槽任天堂做工辣鸡，这次真是见识到了。（眼镜腿旁边的白点就是，手机拍的不是很清晰凑合看吧）,2
网络差，下载速度有了，但是玩不了马车。咨询了一下客服，建议重置路由器，试了之后可以，但现在又不行了。总不能每次玩游戏都得重置路由器吧！？,3
"流畅度：机子暂时没有任何问题，很流畅，速度也很快，网络很平稳，下载很快
画面效果：switch分辨率不能强求?
外形外观：很好看，红色不是想象中的大红，比较偏橙红
吐槽:京东的蜜汁操作，双12下单的2199套装说次日达，13号等一天没等到，发现主机有货，配件没货要大概一周后才有，发给我就一定要一起发？一定要等配件也有了再发主机？就不能有啥先发？还得我自己找京东物流的客服说分两个运单发，买的时候咋不说呢，买的时候怎么点哪个套装都写着次日达呢？那我要是嫌麻烦懒得找物流说，是不是就得一周达了，要是仓储物流有问题能不能就别保证次日达，服了，希望大家以后买东西先问好
果然买国行还是太勇士，啥都没有，还是孤儿，不过还是支持国行，希望越来越好，最好能多过点游戏，提高审核速度。
震动反馈的确很爽，多人游戏一定会很开心，一个人的精彩也是聚会的精彩",3
想了很久的这款游戏机是终于下手了，选择的国行就图个方便了，加上价格也美丽，买这个也是个情怀，小时候打超级玛丽的时候，哈哈，又可以了重温一次了。产品品控一般，店家在页面标注的是主机+游戏卡+包和贴膜，但是到货发现没有包和膜，售后客服来一句这套餐不含包和膜，后来给他看了证据才改口说补发！真是够了！,3
"外形外观：刚拆开屏幕表面灰尘，任天堂品控就是差。
产品包装：收到包装盒都烂了。
流畅度：系统很流畅，游戏加载也很快。
运行速度：就一个游戏，运行速度再快也没用。
稳定性：等了一个月，就放了一个月，稳定性我知道个鬼。
画面效果：画质还行。
总体来说，就是买来吃尘，国行的游戏审核太慢了，一个游戏主机没有游戏就是没有价值。",2
东西是好东西，肺炎期间取消了日本行程，买不了日版，那就买个国产玩玩吧。结果腾讯爸爸就弄一个游戏啊just dance还不能联机，希望国行赶紧推出联网功能和支持更多好游戏得下载。有个不足，左边那个手柄连接处是松的，不知是通病还是我这有毛病，懒得换了，但是心里还是不太舒服！！！！！,2
"这个国行的里面自带了一个马里奥的体验版，关卡不多，无聊的时候可以玩上一会儿。其实我没太搞懂国行和非国行的区别，没有空去研究。平时都是用卡玩游戏，就也感觉还好，而且手上几个游戏都是健身类的，感觉就是一个好玩的健身卡。买了国行，还是觉得有点被阉割
还有就是物流配送，希望以后用正规包装配送，不要一层保鲜膜就给出库，厂商和京东沟通好，不要总是折腾客户",3
"流畅度：机器性能虽然不是先进，但是游戏流畅度很好。
运行速度：玩了一个预装的游戏，运行速度较快，没有感觉到卡顿。
稳定性：稳定性方面没发现什么问题。
画面效果：720P已经落后了，但是实际使用起来效果还不错，优化做的很好。
外形外观：外形外观上还有需要改进的地方。比如按键的间隔可以扩大点，左边的手柄是不是可以直接设计成十字键等等。键程比较短，手感偏硬，个人觉得不如PSP舒服。外形有发弯的情况，估计是设计和做工问题。
产品包装：包装必须差评。套装直接用一个普通的塑料袋装着，到手都破洞了。包装盒也多处受伤，可以说惨不忍睹。
其他方面： 感觉国行发布有些着急，只有一款首发游戏，给人体验确实不好。另外，首发和双十二活动太乱，预售也没什么用。希望多出国行版游戏吧，或者给个曲线解决方法。毕竟买游戏机，不是为了买机器。为了情怀买单，但是也希望国行别太坑。",3
"优点：良心腾讯 商店全部游戏只需299? 用钱创造快乐，国行勇lie士速来. 
在线运行流畅： 前期看腾讯视频一点也不卡 还没有广告
价格高贵：明显比其他版本价格高100-200块 能体验到多花钱快感
机子系统有bug维护较为迅速：可以看视频的bug已经被腾讯給关掉了。麻花疼牝。
最重要的是听说买机器送老婆
实在是单身?dog的福音
请问我的新垣结衣老婆找腾讯领还是找任天堂领
缺点：①腾讯全家桶竟然没有给我按！我尊贵的switch 在线功能没有（听我一句建议，腾讯赶紧开启尊贵的QQ在线功能。销量必定大涨）
②机子是弯的 我的个乖乖 任豚品控实在是不敢恭维
懒得换了 我只是买来玩健身环大冒险的 想玩其他游戏的 听我一句劝 速速远离",2
"流畅度：游戏不多的情况下说流畅度不能算精准。一个游戏，流畅。
运行速度：一个游戏，速度可以。
稳定性：一个游戏，稳定。
画面效果：看惯了三星手机的显示屏，switch算是渣的了。有比较才有伤害，没有比较的情况下，switch还行吧。
外形外观：国行与其他区域的一样。
产品包装：一个大盒子，塑料袋装来了。所幸盒子没坏。
就只有一个游戏，腾讯就开卖switch国行版确实心急了些。而且一直在调整套装变相降价，得到用户的差评和吐槽也是在所难免的。本人买的目的很单一，就是买个儿时的怀旧。情怀的基础上，有个超级马里奥可以玩就行了。本人一直是个游戏渣，一个试用版六关，勉强通过两关。插了个马车8的卡，随便玩一下。
如果是个游戏爱好者，目前还是别买国行了。本以为腾讯代理会好些，实在不行，腾讯自己的游戏上呗。可是给出的答复是只能无限的敬请期待，这个做法实在对不起用户。",3
"流畅度：专用游戏机，不不在流畅度不好的说法。
产品包装：包装一般，比较简陋，类似一般品牌的大型家电包装。达不到大部分手机的开箱体验。
外形外观：做工一般，塑料感挺强的。松松垮垮的。
以上NS都是这样，别指望有啥惊喜。
目前来看，国行目前是比差的版本。你不能指望审核速度赶上同步全球，目前过审的游戏也不多(1个)，DLC也不支持，没有联网游戏功能。别说没关系，你花的钱并没有更少，但是得到的服务是少很多的。我们可以不用，但你不能没有，毕竟钱是没比别人少花的。想入的慎重考虑，等等党最后的倔强。
入了少个念想，之后出了新款，不做等等党了。",3
首发入的国行，不得不说12期免息+包+膜+200G卡套餐+50东券+京豆优惠还是划算的。国行除了主机外一切配件通用，不过主机不能与外服联机且不能购买外服DLC内容（对于联机玩家、数字玩家和DLC深度玩家是致命的），国行游戏过审速度也奇慢无比，终究是个阉割版本。没有免息优惠后价格也没什么优势了，目前入手国行千万要慎重，只有最终解除锁服之后国行才能成为真的首选。,3
游戏出的太慢，游戏卡部分不能用,2
这么大的箱子竟然不放几个气垫缓冲一下。。。差评,2
国行@啊，啥游戏都玩不了。,3
能玩的游戏太少,3
屏幕有坏点，这翻车翻的让人很不舒服,2
流畅度：国行商城就一个游戏也敢拿出来卖，无语,3
产品包装：包装有明显破损，很大一个口子。,3
产品包装：破损极其严重！，包装在运送过程中被磕破了好多处！,3
说实在，现在买国行switch很不适宜，就一个游戏！买海外版卡带，好坏参差不齐，不敢下手！既然入手就好好当个&ldquo;国行烈士&rdquo;，配合健身环当个健身器材！！?,3
在你们买之前请考虑好或者查好资料，反正我买了有点后悔。衷心的忠告。,2
真是京东二手市场，跟旧的一样！,3
给三颗星的原因是商店的游戏太少了，难怪会说国行勇士,3
售后很差，通病是方向自己键漂移,2
12号买的16号到。。。。速度太行,2
先给3星，有了后面才值五星。谁让就一个游戏呢。,3
软件太少了，入手国行确实需要慢慢等待！,2
只能说这个阶段不要买国行，游戏太少！,3
游戏太少，被客服耍了 ，交智商税了,2
真的坑，只有三个游戏可以玩。,2
国行的一系列问题我就不多说了，京东这个快递真的是稀烂。纸盒就用一个塑料袋包着就送来了？？盒子到处都有破损。,3
保护膜有划痕，粘贴好以后很难看。,3
游戏出的太慢，没有游戏玩，买了白买！！！,2
游戏手柄太小，游戏种类太少，游戏卡太贵,3
非常**！游戏少的可怜！千万别买！,2
差评。没游戏u,3
国行商店游戏只有1个，用卡带换来换去太不方便,3
产品包装：物流速度是真的慢，当时下单写着当天下午到，结果等了四天左右才到货，而且包装还坏了，虽说机器没问题不过很不愉快,3
机器很好，国行很垃圾，一个月了都不出游戏,2
我买的这台，蓝色手柄晃动的厉害，红色手柄就很紧,3
没游戏玩可太难了。。,3
除了有个体验版的马里奥，啥游戏都没有。**！,2
非常**，刚下单就送闪存卡。。。只有给差评了！！！,3
感觉做工一般，尤其是手柄，拆装都很紧，像是地摊货。,3
还没玩包装就一个袋子收到货袋还破个口子怎么也是过千的东西好好包装一下不行吗，没货也能拍，等了很长时间才发货佩服,3
三星吧，希望游戏抓紧过审，现在只有塞尔达玩着很慌,3
品控太差了，各种划痕脏污，要不是密封条完好，真以为是二手货。,2
背后switch标志有划痕  19年的机器有点老了  买完就降价50  也是服气  不愧是***,3
太垃圾了，都不能联网。只能线下，不建议买。,3
等了这么久，商店还是没有东西，一颗星给国行，一颗星给能插卡带,2
"国行没后门就是砖头，我**真的气死了。
还是动森limt香",3
屏幕不够硬，擦拭需小心。套装配的膜也很烂，最好单独买算了,3
游戏太少了,3
游戏很少，很贵，机器还是标配，总体不是很建议买这个,3
买了一个月了，也没有发布新游戏，太后悔了,3
都一个多月了，还不上游戏，我真的服了，春节都没游戏玩,3
本来是要送人的，结果去网上查了一下，就几个游戏，国行锁区，上新游戏很慢，果断退货了！,3
第一发，翻车，包装破损，申请换货中，电子产品你不外套纸箱，你给个套个塑料袋。。。另外封条这边，仁者见仁智者见智吧,3
买了必后悔，千万不要买，已经是国行烈士了，只有一个游戏我玩个锤子，赶快把腾讯告上315!,2
没游戏国行买了积灰，游戏卡又不敢乱买，买了要不是最新版就凉凉，卖主机自带商城就一个马利奥**呢这是！,3
产品包装：产品包装陈旧，完全看不出全新的感觉，腾讯封条也有撕过的痕迹。而且盒子一来就是破的，售后的答复是只要能用就行,2
产品包装：第一次拿个袋子就送来了，盒子都撞变形了，申请换货等了好多天送来了，盒子一个角还是撞凹进去了。懒得再换了，快递也太暴力了。,3
不知道国行只有一个游戏，所有著名的switch游戏都还玩儿不了，感觉被坑,3
产品包装：这包装也太简单了吧！购买的套装，就用一个破袋子装，京东用不起纸盒了吗？游戏机盒子已经破损了，正不敢想象它一路经历了什么，还好开机试了试没有什么问题。,3
收到货后打开仅一款游戏，没有在显明位置标识七天内不支持拆封后退货，比较差的购物体验。为保证消费者权益，建议监管部门予以关注。,2
国行的商店目前只有一款游戏，只能玩卡带，感觉比较垃圾,3
有赠品的要好久才能拿到，无奈只能买没有的，多次投诉也没用。垃圾,2
国行品控依旧很渣，12月10号到货开始玩塞尔达，12月21日已经摇杆漂移了。。。。才十一天。。。,2
switch很赞。但第一次见包装这么差，第一张是我朋友买的switch（相同套餐）包装。后面是我的。包装不完整，未封闭有开口，盒内一个泡沫或者气囊都没有。请给予解释，谢谢。,3
第一次买switch，本来还是很期待的，但是大的快递外包装封口开了一半，主机包装盒的封条被撕开了，里面的基座还有几道划痕，这一下下的给我的热情浇灭了一大半,3
"1.一般，中文游戏太少，不能玩dlc,游戏买二手或者外服折扣没有优势：2.节日必定降价，请保价，还是外服香",2
"产品包装：运输过程中有破损
外形外观：拆开后不予退货，真是无语
流畅度：东西国行锁区，这么多的销量有待考证，估计是假的",3
一打开包装内包装就是被拆过的，这是直接断人家后路啊！7天无理由就是个笑话，产品先不说，这点就让人很不爽了。一直想要一台游戏机，国行ns是我的第一台，纯粹是支持，希望国内游戏环境越来越好，更加开放，&ldquo;国行烈士&rdquo;不希望真的应验，只能说未来可期吧！,3
差评差评差评，妈的，刚发行买的打开包装就看见封条开的。那里的纸壳卡扣有很明显折痕，是不是被退货的？不爽，京东你解释下。,3
买了国行有点后悔，只能玩卡带的塞尔达，还没有dlc。塞尔达等了这么久，国行也没出，失望！,2
产品包装：拿个袋子装上送过来的，盒子都撞变形了，换货等了好久，还是撞凹进去一个角，懒得换了，换货太麻烦，等的时间太久了，本来快递就暴力，京东包装加固还不行。这次体验太差了。,3
说实在买了是挺后悔的  毕竟只能单机  也不知道什么时候才能完善  要不是最近只能宅家里应该不会买  还要吐槽物流  下单之后发现地址错了于是改地址  原本只是相隔20多公里的两个地址 用了3天才送到  联系客服就一直说给我催促但都没有结果  一直给我都能查到的信息  我也不知道我都能查到了的信息  客服是干嘛用的？还说是plus专属客服根本就是没用的，这点真的要被气死,3
我应该是脑子进了大海才买了国行，发布两个月了只有一款游戏？！我是买游戏送游戏机吗？！,2
游戏大厅里只有一个游戏，桑心。硬件是好硬件，但由于各种天气原因，这里面的软件基本上全瞎了。不建议现在买。,3
说实在的确实一般，游戏就一个.游戏的上线速度也很慢，卡手柄的地方还松动.,2
目前除了注册比海外版的方便一点，其他一点优势没有，刚上市不到一个月就有别的平台降价200了，以后真心不敢买首发了，运输也是盒子直接套个塑料袋就来了，体验真的不好。,3
没游戏这种老生常谈的话题就不说了，但套装里的存储卡已经两个月没有音信了，京东客服能靠谱点吗？？？,2
"东西是好东西，正品。但是被戏耍了是真的难受
12月9号预约的，12月10号了告诉我缺货，白等一天，一直在京东买东西，这次是真的感觉被戏耍了。",3
快一个月了还只有一款马里奥，买你何用？全靠非国行游戏卡？辣鸡玩意,3
"真心不建议买国行 叉开一不可退
试过才知道只有一个游戏 应该早说明 好失望 收到
至少老公喜欢吧",3
目前商店只有一个游戏的体验版，内容太少。网上卖的游戏实体卡价格太高，游戏成本让人承担不了，玩不起。,3
"理性评分★京东物流一星都不想给，好歹2000+的东西，你就一个塑料袋，塑料袋破了用胶带打补丁?这是什么操作？包装盒也破了，鬼知道我的游戏机经历了什么?嫌麻烦懒得退了，因为光发货就用了一天，还好机器没事。
流畅度：优秀
运行速度：优秀
稳定性：优秀
画面效果：优秀
外形外观：优秀
产品包装：极差",3
"流畅度：没话说
运行速度：没话说
辣鸡，十分辣鸡，一个半月了还只有一款游戏，只能放着吃灰",3
目前只有一款游戏既然就开始卖主机，都是自己的错没了解清楚就买，无敌坑，下载商店既然是空的,2
国行烈士前来报道，到手五分钟就后悔。想退客户死活不退。 目前花400买了塞尔达卡带。也不算真的吃灰，但是国行要翻车是迟早的！,2
"外形外观：买完才知道 防伪标上面有字母是拆过的啊
这次有点失望 送货很快 收到二手机有点不爽，应该是摸摸党摸几天退了 太倒霉了",2
刚买就降价。。。虽然就30块钱，但也是一口气。锁服不锁区很痛苦，只有一款游戏你还卖什么SD卡啊！速度解决游戏送审后再卖SD卡呗。真想要的手办缺断货也不补货,2
我是很支持国行的，就是这个joycon质量，按键ZR和ZL接触不良，还有送修预计时间，特别影响体验！自己的第一台机子，修要10天寄回！体验极差！,3
"做工一般，稳定性一般。
新机器左手柄蝴蝶状晃动。膈应死了。
玩儿舞力全开还会手柄失联。",3
机器大问题没有 但是背后那个支架直接是掉下来的 刚打开就是掉下来的 桌面模式无法使用 找客服也找不到半天都是机器人,3
之前在欧洲买了个，商店很多游戏 还有免费的，这个国服版商店就一个游戏 ，switch本来游戏就没多少 国服太让我失望了。这台给女朋友玩 不知道能坚持多久吃灰,3
非常不好的时候一次购物体验，为了支持国行，首发入坑，手柄异响换机时长半个月之久，无奈游戏太少，只有一款，真的要成为孤儿了吗？,2
运行速度：可惜腾讯只有一个游戏我想把它给退了，本来想着会有很多游戏的，谁知道只有一个无聊到爆炸的游戏,2
物流包装简陋，安全性差！设备性能未知，还未拆机，物流中产品受了内伤损害，处理的时候又是推卸责任，什么时候京东物流这么简单暴力了w,2
因为锁服，而且目前并没有后门，目前现有的switch联网对战游戏都玩不了。只能玩单机游戏而且无法下载单机游戏的dlc。送的体验版游戏只有6关，国服游戏只有这一个，目前来说非常非常不推荐购买。没有买日版合算，听说现在海外版网络连接变好了甚至可以直连，有待考证。,2
说好的游戏呢？奥德赛跟荒吹暂时拿不出来我忍了，马车都没有要你何用？只能差评,2
这个swich大家千万别买国行的，就一个游戏，其他的都得自己花钱买卡带，简直是一个坑，千万别买，还不让退货，第一次给差评,2
做工质量没得说，但是国行支持超级玛丽太坑了，而且国外卡带游戏只支持单机版。买的人注意吧。,2
听我的两位朋友说 他们也是今天到货 可他们的快递都是纸袋包纸张再包游戏机 而我确只有纸袋包着 所以游戏机箱子都是破损的 图片可以清晰看到 然后我问了客服怎么办的时候 却被推托了 有图有真相,2
三星给国行版三个字，终于有了正规渠道，但是生态体验太差，商店里只有一个游戏，不能联网使用其他区域的数字内容。,3
不知道 送人的 反正物流太差 错过了送东西的时效 况且快递也好玩 第一天送了说掉了一个包裹 找到一起送 然后到货就是两天后了 感觉白花了这个钱 因为其中情况简直无语 后悔及了 写得我都想笑 因为心情收到极差的影响 算了 就当买教训,2
"收到机器很开心，正准备贴膜时候，发现屏幕上已经有膜了，很奇怪，问了客服说新机没有膜，说从我的照片看不出贴膜，很好奇，刚开卖就有二手的了吗，目前在联系京东解决中。
大家有遇到这个问题吗，求解",2
