comment_sen,score
流畅度：大概八点到几点能到呢等不到你,3
选了包含&ldquo;HORI NSW青春套装（EVA轻薄硬壳保护包+LCD保护膜）&rdquo;的组合，只有主机的相机，没有看到&ldquo;保护包+LCD保护膜&rdquo;,3
国行勇士，买之前不懂，买了之后懂了。,3
国行机，买卡带吧,3
饱经风霜的插头,3
自己不明白为被腾讯割了波韭菜，买国行的一定要三思,3
除了包装破损其他都很好，国服eshop希望快点更新,3
真好，我只花299就清空了商店,3
游戏太少，希望尽快来解决。,3
目前不建议入国行,3
游戏什么时候出,3
国行现在不彳亍,3
等待时间的真正检验,3
没有游戏啊，亲爱的腾讯。,3
唉，入错坑了，还是要买港版或日版的,3
就是一块砖，哪用朝哪儿搬,3
大家都说买国行就是买钻头,3
包装还好，买错版本了，后悔啊，真的不要买国行各位。,3
买回来，没有游戏可玩，国行就是**,3
东西还不错，客服十分的不专业，乱七八糟，不知所云。,3
购买的套装，先把主机送了，游戏卡没有随着一起送来,3
"国行烈士
现在推荐买海外版，以后不一定",3
"流畅度：挺流畅的
稳定性：左边手柄有点松，全看运气",3
两天就促销？你还不如别卖了吧，等来背刺可还行，ns本身没问题就是了,3
闹心。,3
略坑,3
是正品，继承了任天堂一贯的塑料玩具做工。,3
国行勇士,3
送朋友的,3
居然买了国行,3
随便玩玩的话，国行能将就。有更高需求的话，还是算了吧,3
国行不推荐。,3
首先我愿意支持国行也希望国行越来越好，但是现在游戏太少了,3
冲动消费，体验一般吧。,3
没游戏,3
没游戏,3
国行机还可以就是游戏是真的少就一个，已经开始吃灰,3
应该听取别人建议的，买了是挺后悔的，好吧，当了回国行勇士,3
回来就被闺女霸占了，我给三星是因为蓝色的一遍活动，我也懒得换了,3
"稳定性：可以
画面效果：可以
外形外观：边框宽了宽了宽了宽了宽了一点一点",3
买之前看评测说有好几款游戏，买了后发现在线下载只有马里奥一个，还得买游戏卡。,3
"感觉质量确实如网友所说&hellip;我买了几天来着？
游戏也跳水&hellip;",3
国行游戏进有一款，通关了，目前用来盖泡面,3
国行游戏就一款，买其他的游戏只能玩单机就算了，还没有服务器可以连，抓紧点吧,3
谁说网络稳定，速度快的，一晚上下个马车才下18％，更新主机一个多小时，真是呵呵,3
买前没做功课，结果买了才知道国行锁区，有条件的还是买日版或美版吧。,3
买国行本来就满苦逼了，当天就发现秒杀活动有优惠，问了主播说可以用价格保护所以放心了，最后申请时发现套装价格不通过。,3
eshop只有一款游戏,3
本来奔着支持国行销量的想法入了国行，但游戏机出了那么久了还一直画饼，什么时候能准确说上新的游戏,3
买来可以当传家宝，因为你玩不了几天就只能吃灰了！,3
勇士变烈士,3
"东西是好东西，客服是好客服，快递是好快递。
游戏你快点出行不行？",3
还分开发货给个游戏机，卡带还要等，拿个游戏机干瞪眼。,3
感觉自己买了块砖头，什么游戏也没有&hellip;&hellip;期待后续国行多出游戏吧,3
游戏机不错哦有保障，就是没有游戏玩，哈哈，买非行货卡带吧。,3
"流畅度：运行流畅
运行速度：速度很快
画面效果：画面清晰，效果很棒
产品包装：产品包装不错，唯一让人气愤的就是送来的时候只有一个塑料袋包装的，京东你差一个纸箱的钱么？这么贵的东西包装这么草率，真是无语",3
因为疫情日版swich断货+持续高价，所以入手了国行版，其他都好，就是不能添加国行版以外的好友，结果硬是把动森完成了单机版，如果再买一定要买国际版,3
目前国行版只有三个游戏！希望加快更新更多游戏，玩起来还算流畅！但是刚刚收到快递发现外盒被打开过再封上的，问了快递说商家给的就这样！,3
等了2个星期，没有后门，游戏还是只有一款。支持国行的同时也希望腾讯能重视switch这个项目，不要让我们这群国行支持者变成水军口中的烈士。,3
2000多块买一个游戏 真香 别叫switch旗舰店了 叫马里欧兄弟体验店吧,3
很好，盖泡面压的很严实，砸核桃也还可以,3
期望越大失望越大，商城就一个游戏万年玛丽奥，京东快递不错，快递小哥客服不错！,3
"1.就商品来说，等国行等了很久，最终日版和国行还是选择了支持国行，但愿腾讯能早日开后门，只要开了，地表最强主机无脑吹，要不然真是孤儿主机
2.购物体验来说，下单时候看第二天到就选择了京东，毕竟一直比较信任京东物流系统，但是这次中间出现调货的问题到手等了4天，不过反映问题后客服及时解决和电话回访还是挺不错的，但还是希望即使更新仓储信息，不要在购买页面库存配送上造成误导",3
"流畅度：很好
运行速度：很快
稳定性：无明显问题
画面效果：一流
游戏只有一款可以下载，三百大洋。然后就没有了。果断选择退货",3
"流畅度：不错
运行速度：不错
稳定性：不错
画面效果：掌机模式怕瞎眼都用电视玩的
外形外观：不错
产品包装：我是无语了每次都用塑料袋装着送东西，几十块也是几千块也是京东物流想干嘛？
switch在我心里就几个不足1屏幕太差看久难受2游戏比较贵PS4PC上几十块游戏它就要卖200多很不爽。",3
"送给男朋友的，他说我居然给他买国行。。。他说他要珍惜我这个傻姑娘。
关键字在傻上。。。
他说国行是块砖头。",3
"流畅度：很流畅嘛
运行速度：挺可以
稳定性：尚可
画面效果：掌机720可以
外形外观：没有Tencent企鹅标，减分
产品包装：我相信发来是没问题的，物流出问题了呗，包装明显被挤压破损了，减分
总的来说游戏少，也在预料之内，总体购物感觉一般，很一般",3
"早买早优惠早享受，于是早早付定金预定。后头一天出一个新套餐，想补差价升级不行，想退又退不了，找客服全是套话，这波操作真是让人寒心。哎
流畅度：完美
运行速度：完美
稳定性：完美
画面效果：完美
外形外观：完美
产品包装：完美",3
游戏可以说没有，除了一个马里奥兄弟，还是期待腾讯下一步动作。。希望能给玩家跟多惊喜,3
国行版，不兼容其他游戏，这个是硬伤。目前只有马力欧一个游戏&hellip;&hellip;买之前没仔细研究。但产品确实不错，大人小孩都喜欢！,3
机子不错，可是没有游戏啊，天天只有一个顶蘑菇，早都玩腻了，快点出新游戏吧,3
"流畅度：运行很流畅，自带马里奥体验版，看了一下大小，700多M，运行没问题
稳定性：稳定性也很好，没有死机和闪退现象
画面效果：效果还行吧，虽然不是1080p，但对于游戏来说也足够了
外形外观：外观很棒，我还自己买了一套保护壳，超萌
产品包装：包装有点差，外面就一个塑料袋，口子还是开着的，被人随便用胶布封了一下，安全性很差",3
"流畅度：可以
运行速度：可以
稳定性：才玩几天不评价
画面效果：还行
外形外观：过得去
产品包装：可以
唯一美中不足！没有游戏玩&hellip;&hellip;&hellip;没有游戏玩！！没有！！游戏！&hellip;玩&hellip;",3
"流畅度：快
运行速度：快
稳定性：稳
画面效果：将就
外形外观：可以
产品包装：可以
就一个游戏，两天通了不知道干嘛。",3
国行机子性能稳定，外区卡带可以玩可以更新，无法联网和购买下载DLC，游戏过少，同时硬件质量堪忧，主机长时间使用易变弯，未来可期，目前并不是最佳入手时机。,3
"画面效果：非常好
稳定性：非常好
运行速度：非常好
流畅度：非常好
外形外观：非常好
产品包装：可以
缺点：应用商店里就一款游戏，真的很疼逊，没有游戏玩，机器再好就是一块板砖，而且在网上买正版游戏还得从香港发货，慢得一批。",3
"学生党顶着&ldquo;国行烈士&rdquo;入了，毕竟日版涨到三千多快四千了。物流很快，昨晚下订单第二天就到手了。果不其然商店只有三个游戏，不过下载5个g的马里奥就用了一个小时还稳定。如果奔着单机玩、有钱买卡带的话国行会便宜不少，但深度爱好者不推荐
画面效果：比我的手机好",3
本来买的时候活动送一张128G存储卡的，显示说plus会员购买switch+128G存储卡只要2099，但实际并未收到存储卡，当你和客服询问此类事件的话，请持有有效证据，不然她会向你证明不存在这些活动，希望大家在购买switch的时候小心此类套路！,3
"和日港比，优势只有保修和网络了。
提前买了几张卡带，也不能买dlc?。
游戏玩起来还是不错的，续航时间大概在四五小时，
但是个人还是不建议买现在的国行?，有wegame那味儿了?。",3
"流畅度：挺好的，很流畅，就是游戏比较少
运行速度：跟手机有的一拼，就是游戏比较少
稳定性：很稳定，目前没有出现什么问题，就是游戏比较少
画面效果：画面很清晰，就是游戏比较少
外形外观：cool，就是游戏比较少
产品包装：挺好的，就是游戏比较少",3
机子不错的，各项也非常满意，唯一一点，游戏机就一个游戏有点尴尬了，我心里还是有点发堵，拆了退货退不了，只能留着看看，客服态度还可以，希望国行有起色吧，留着多看看吧，让心里更好受一些，快递速度倒是很快好评，也很细心，谢谢快递小哥。,3
"流畅度：还是不错，操作算是流畅度挺高，但是游戏没什么，无法评论
运行速度：算是流畅，因为国行也没什么游戏
稳定性：没有游戏测试无法评定
画面效果：追求画面就算了
外形外观：颜值担当
产品包装：差的很，那个包装箱子都不想评论，还好里面东西没事
黑色还是容易粘东西，没游戏，等游戏，唯一一个游戏真不想买，好无聊，何时能出?？",3
"疫情期间在家实在无聊，最后入手了。由于之前没接触过，还是以单机为主线，考虑到国行后期的发展，最后入手了国行。只是国家的审核速度实在太慢了，到现在为止就一款游戏。
流畅度：这个主要还是得看游戏的优化度吧，设备本身流畅性没问题。
画面效果：在这么小的屏幕里1080p的分辨率玩游戏足够了。
外形外观：红配蓝的外形很漂亮，但建议还是多加个pro的手柄。",3
还行吧，说续航增加感觉也没增加个啥，感觉100的电量5分钟就掉百分之一的电量，劝你们现在不要买国行的版本，真的，商店里面就一个马里奥游戏，还要299，买港版日版的还能租游戏玩，买了一个just dance游戏卡，还不能联机&hellip;&hellip;希望国行的赶紧增加游戏吧，不然就要吃灰了&hellip;&hellip;,3
"憋了这么久等来了国行，然而这么久了，天天马里奥，白瞎了这么好的设备；
硬件当面整体感觉良好，暂时没有遇到硬件问题，体验下来还是很不错；
软件方面，马里奥虽然可玩性也不错，游戏也挺有趣，然而天天拿着两天多的游戏机玩踩蘑菇，还是太那个啥了，这个体验太差了，既然游戏这么少，为啥这么着急开卖呢？",3
"很好，很靓。以前基本没有认真评价过,不知道浪费了多少积分,这个福利利真的不错;妥妥每次都写- -百多字这是第N次在京东_上买东西了棒棒棒，好厉害好东西便宜而且质量好，物美价廉，买的放心，用用的开感觉都买上瘾了，买买，根本停不下来，东西品种多而且又特别全，划算，方便，而且实惠包装很好，而且没有任何损坏，会- -直支持下去的，服务很好。这是一个好评模板，因为本人很懒，不想每个产品都写好评，所以特地模仿一位网友写下这个模板,但是这个产品无论是质量还是外形肯定都是本人喜欢的。",3
"流畅度：只有超级马里奥，流畅度快的没有话说
运行速度：只有超级马里奥，运行速度快得没话说
稳定性：只有超级马里奥，稳定性快的没话说
画面效果：只有超级马里奥，画面感和介绍的一样
外形外观：可以
产品包装：可以
当时买的时候在ps4（因为自己比较喜欢玩战地）和任天堂犹豫。个人感觉ps适合一个人慢慢玩，任天堂适合二人以上好玩些",3
"稳定性：网路链接不是很稳定，经常性出现错误，如图所示，需要来回切换网络才行，很影响使用心情
外形外观：挺漂亮也很经典，大气也是有的，百分百新机，因为味道很重?
产品包装：完整，防伪贴做的是真好，完美杜绝退换的可能?，机子网络稳定不好影响体验也不可。
流畅度：很流畅，除了网络不稳定外
运行速度：棒，但是没发现可以关机，只能休眠
画面效果：棒棒哒，游戏商城游戏是真少，都腻了",3
"流畅度：拿到货后就迫不及待的去尝试一番，整体还可以，流畅
运行速度：运行游戏速度没有卡顿，就是游戏加载耗了点时间，或游戏里需加载动画时停顿，可以接受
稳定性：比较稳定，至少玩了这些天，没出过问题
画面效果：清晰度还行，但非要和高清细腻的画面比，那就没有可比性
外形外观：比平板小，比手机大，握手里，合适
产品包装：物流真难免磕磕碰碰，外包箱都有所损坏，已上图，游戏机还不错，就是游戏真的真的非常少，非常的失望，所以差评就不给了，但好评也给不了，只能给个综合的",3
"作为掌机来说，switch还是偏大了些，由于国行首发没有switch lite，只好选这个了。TV模式基本用不上，而且要追求画质的话，另外两大主机可以说完爆switch。好在支持桌面模式，两人合作或者对战时比较方便，比switch lite贵点，也算值回票价。
可能出于流畅度和功耗等考虑，屏幕分辨率不算出色，这点可以理解。但屏幕外层是塑料的，好像也不是全贴合工艺，使用体验上就很一般了。
买国行主要是看中保修，万一摇杆漂了送修方便些。外包装的一次性防伪封签很松垮，揭开后基本完好无损，纸盒上也看不出什么痕迹，希望是个例。机器上手很惊艳，论做工用料，国产手机也可以超越它了，但论设计和创新，任天堂还是有一套的。希望国内厂商奋起直追。
需要吐槽的是，这次的营销策略对首发用户不太友好，机器刚到手就推出了更加优惠的套餐，真是套路满满。希望国行游戏能尽快丰富，另外京东多搞点活动促销，让国服早日红火起来。",3
什么都好，没有抢到赠品不开心,3
唯一的缺陷就是盒子坏了,3
产品包装：包装被打开过,3
产品包装：包装破损，,2
说实话我后悔买国行了，其他版本的难道不香吗？,3
"画面效果：开机姨妈红
产品包装：包装盒有点破损",3
次日达结果等了一个星期,2
只能玩马里奥，无趣,3
产品包装：游戏机包装送过来是坏的,3
没有收到赠品，不知道什么情况,3
外形外观：标签是没有粘上，到手的时候是打开的。,3
买回来屏幕就有划痕，翻车了,3
缺陷就是很多受限制玩不了,3
不要变成一个笑话,3
早买了，后悔呀，想不到还有更划算的套餐,3
呵呵，不出游戏起码开联网吧？,3
右边手柄松，左边手柄紧,3
双人玩马里奥，一个人死的时候有卡顿啊,3
买错了不能退货而且只拆开袋子,2
感觉不是太行，我的左边小手柄卡不稳，会晃。,3
产品包装：就套了一个塑料袋 真的敷衍,2
屏幕有个灰尘 不想折腾没退,3
产品包装：这是怎么回事？感觉被人拆过一样,3
画面效果：屏幕分辨率没有日版的清晰,3
从国行勇士变烈士了。。一个游戏。。,2
国行游戏就就几个,2
千万不要买国行，我是不太懂，开封了退不了。,2
就一个游戏，呵呵,3
预约+0点购买 为啥没有搽机布或者是抽绳袋啊,2
第一次看到连不到外服的主机,3
完单机够了，想要连击什么的就算了吧,2
产品包装：里面连个说明书都没有，只能扫码看怎么连接,3
比外版差的有点多了，只有价格优势,3
只能说，国行烈士买了块板砖,2
商店里就一个游戏，插卡也连不上服务器,2
现在不能买  巨亏,2
锁区了，不太行，手柄那里质量一般,3
快递不怎么样，这种电子产品居然外面就一个快递袋，万一被压坏了呢,3
"为啥613买的和618买差距差那么多 1年会员还送个袋子 我不服
产品包装：靠",3
该知道的他们说的都对不过可以观望一下,2
"流畅度：很好哦
运行速度：快
产品包装：很好",2
包装拆过的，可能是谁退货的吧，左边手柄松动。唉~,2
没游戏不给满分，再不出马车8或者塞尔达这些就别想大卖了,3
封条断开，里面东西不知道有人动过没，心里没底，承诺补发的膜现在都没有到。,3
游戏少，只能买卡?,2
充不上电，拿回去返修了，感觉质量不太好,2
就游戏少，其他OK,3
价格便宜，但是只有5个游戏。。。。。只能用实体卡,3
哈哈哈，这个游戏，我不想说了,2
本来看有没有后门先不开封的，但是还是忍不住开了，先玩着卡带先吧。,3
感觉挺失望的,2
比港版有唔同,3
退回去了，朋友全都买了日版，而国行又不能和他们联机，游戏又少，所以退掉了,3
被拆开过，封签都掉了,3
刚买完就套餐就降价，物流包装不行箱子边角碰的挺厉害的。机子是全新的，还不错。,3
迟迟不上游戏，无话可说，国行勇士怕了,2
国行没有线上游戏就只有马里奥系列，其他的全要卡带,3
买了2个多月了，还是只有一个游戏，，，体验极其差,3
没有游戏,2
买回来玩了4天就有问题了，提出维修一周没进度。,2
游戏类型少,2
连不联网,2
别买国行！！！,2
才2周，右方向键就松了&hellip;,3
东西很好，但是游戏太少，一个月都没有上新游戏，一个马里奥玩到死。,3
封条感觉被人开过，快递回来就一个袋子装的，袋子都划破了，箱子上面还破了一个洞，什么情况？,2
从抢购到入土,2
"包装一看就是拆过的。送老公的圣诞礼物，没时间换了。
国行商店里什么都没有。",3
拆开来发现有磨损，不知道是怎么回事，将就着用吧，但是影响心情了,3
什么游戏都没有   如果没有游戏卡的话还是算了,2
品控是真的差 后盖居然有点翘 不影响使用懒的换,3
换货后正常，做工品质有待提升，第一台游戏机，感觉一般般,3
勇士国行机买完就变砖头，一个游戏，还不能联网，买完还降价,3
送到家发现，外包装的纸箱被撕开过。虽然东西还在，但这让我体验很不好。国行设备就是比较便宜，但是目前游戏较少，需要再等等。,3
下单前预计明天送达，下单后过了两天才发货，前后5天才送达；包装盒子有碰撞痕迹轻*，机子完好。,2
毛线游戏都没有，不能联网，这国产有什么用。只能吃灰。,3
就只有一个游戏 不知道什么时候游戏才能上 一点消息也没有,3
东西不错，就是游戏太少，还有就是机身上有一颗螺丝像被动过,3
国行勇士加油,2
"速度挺快，还送个体验版（我猜也就送一关吧。。。）

但是包装保护太差了，要送人的东西，外盒子已经压坏了。",2
"产品包装：完全没有任何防护，导致箱子烂掉了！就是一个袋子套着！
画面效果：画面效果很好，坐等老马发售游戏了",2
左边手柄要用松动。说送内存卡也没有发。不太愉快的购物。机子用段时间再来评,3
国行烈士 等到跨年还只有一个游戏 永远的敬请期待 机子还可以 但没有游戏还有什么价值,2
想要联机游戏的快跑啊！别买国行别买国行！完完全全是单机卡带党可以考虑入国行,2
终于等到国产，好东西，和孩子一起玩、一起嗨。唯一就是买的膜不好，还没贴就有问题。,3
商品外观好看，快递物流一流！就是不能联网开账号这个比较不令人不舒服，就只有一个游戏可以玩,3
"买完没货，等了几天才发货，没有像别人说的只套个袋子，箱子配送的，还不错！
现在就是没游戏，只能买海外的卡带，希望国行游戏能尽快上市！",3
别的不说，就说这质量是有点问题，不过其他都还好，客服态度也挺好，就因为这个小问题我也没必要走保修，来回太费事了，希望再生产的时候严格把关！！！,3
除了有保修和更新游戏快以外，其余的根本没法和其他版本的机器比，而且光套包装袋就给我送过来了，还破了几个洞,3
刚刚拿到还不错，但是我看别人国行开箱都有那个腾讯贴标，为什么我这个没有,2
只有马里奥，我一点也不喜欢马里奥，呵呵。tx长点心吧，别把好牌打烂了。当然，除了游戏，其他挺香的。,3
蓝手柄插在主机上有松动，玩起来有点不舒服，只有拿下来在在电视机上才好玩,2
吃了没研究就买的亏。国行别买，没游戏玩的，海外卡带升级不了，连不上网。,2
谨慎购买吧！游戏太少了，虽然之前有心理准备，但是游戏并不是那么好玩，我就是随便买的，因为无聊。其实准备买ps4的，但是懒得弄屏幕，所以就买了这个，希望塞尔达能好玩一点。,3
送货很快，就是国行不能玩动物之森，如果想玩这个游戏就要考虑一下了，国行游戏真的很少,2
国行版，不能玩动物森友会，才有三款游戏，还是我不喜欢玩的，感觉亏大了，由于拆封后才知道是国行的，还不能退货,3
国行勇士，能玩卡带，但是卡带也比较少，估计很多游戏还是没有卡带的,3
当天下单，隔天收到，速度很快，但是买的时候注意下不同套餐，拆封就不能退换了，这点服务一点都不人性化，感觉一般，还没开始用，主要搭配健身环还没到货，后期看看效果。,3
"新机子屏幕上是不是要有膜啊？这台屏幕没有膜，总觉得这个盒子被打开过，开口处有折痕，是不是新机？
产品包装：开口处有折痕，不知道是不是新机",3
东西和包装盒没啥问题，但是这个联网是一会好使一会连不上，也不知道是我家网的问题还是其他人也这样，客户说因为是日本做的，信号源跟国内不一样说换下密码就好使了，我呵呵，如果有类似的请举手,3
"什么都好，就是现在游戏太少了吧。是个不成熟的机器。
太不成熟，还没做好进市场的准备",2
非常好的游戏机，而且可以用外服卡带，唯一缺点就是新机器手柄就上下松动，拆包装了，客服回复如果严重一年保修，真是倒霉,2
产品包装：包装其实都还好，但是我很好奇，新机器为什么没有防拆标签封口贴，我看了里面很多评论，好些图片都有标贴，我的开包就没有，长时间视频没办法上传，能证明拆开包装就没有，但是机器没有问题，有些堵心，三颗星吧，第一次给三颗星,3
"本来没准备买国行，价格真的香。领取200的券后1649。
游戏有点少。希望塞尔达和健身环早点出国行。毕竟国行游戏便宜。
花19.9买了1000-50的分期券，结果免息不能用，还不能退款。引以为戒。
中评不是ns的锅。是京东的锅。",3
产品包装：收到的时候竟然没有封条，以为被拆过了，看了看包装竟然在快递袋子上，开机看了看目前没发现拆过的痕迹，其他都还好，速度也很快。这快递包装不多说了，后续发现问题再看吧。,2
很多游戏都玩不了，建议买日版，还有外出玩游戏还要带座机才能连接电视感觉有点傻，研发游戏有点跟不上时代了！但发货速度快,3
客观评价，硬件机器是没问题，买过来游戏就1个，还是我不爱玩的，只能说tx可能准备不足，你准备几个过审的游戏不香吗,3
"我是个懒人不想退货换货了   这个国行  不能加好友  不能跟其他版本机器交互   有商店没有游戏  全网没有数字版的游戏只能靠买卡带   
好处就是其他的什么流畅  稳定  画面   外观跟其他什么港版日版是一样的",3
没有整体的使用手册，有时候按键指引和实际操作还不一样，怎么按都过不去。操作便利的年代还这么使用不友好，真是少见！,2
来的时候 盒子是坏的  给三颗星星吧  不推荐条件好的入     因为比较穷  就一张卡卖了 买新游戏的  总体还行  就是国行游戏 第一方游戏审核太慢,3
