comment_sen,score
就游戏少，其他OK,1
"画面效果：1080p的效果满分
外形外观：便携小巧，可以外带掌机模式开启
流畅度：游戏加载速度很快
稳定性：从来没有宕机过
产品包装：原装正品
疫情期间拿到机器，简直是居家必备神器，和家人孩子玩卡丁车8，马里奥party，参与感很强。塞尔达传说更是NS的神作，爱不释手！",2
非常失望，现在就一个游戏都没有就是一块搬砖！国行真的差別入坑了勇士们！日版真的比这个好！国行估计两三个月才能出吧。还都是别人玩剩下的。,0
这款任天堂 Nintendo Switch 国行续航加强版 NS家用游戏机 便携掌上游戏机可以的哈，是它们的刚刚发布不久的新品，整体看着相当大气，质感也不错的，我也是最近才购的，果然没有让我失望，玩的很齐全，功能多新款的游戏机玩的给力，手感超好灵敏这个。超级好，价格也很优惠，用到现在，满意的。但是，国行的商店中只有一款游戏：《新 超级马力欧兄弟U 豪华版》。作为首发期，虽然游戏较少，但每一款都是经典作品，对很多新手用户来说，还是很有吸引力的。更重要的是单款游戏299元的价格，类比大多数全球版游戏&mdash;&mdash;特别是任天堂的一二方游戏，还是非常有优势的。在等待更多国行游戏到来的同时，还可以直接去购买想玩游戏的全球版卡带进行游戏，经测试国行Nintendo Switch可以正常游玩全球版卡带并且能正常进行版本更新,2
非常好，孩子很喜欢，不过目前就得买卡带玩了,2
买的首发，居然什么优惠都没，后面没几天就有存储卡，包和膜的各种优惠套餐，这不是坑最早买的人吗？,0
主机到了，运行速度真的很快，虽然只有一个游戏，不过可以插外服的卡带，适合我这种没有接触过主机的小白，支持国服游戏机，国服冲鸭！,2
心塞中，看准购买推荐港版！,0
玩**，就一个游戏,0
"画面效果：很棒，还可以链接电视
产品包装：简约
外形外观：简单
游戏体验很好！马里奥系列游戏很好玩！真的脑洞大开～在家里每天下班玩半个小时睡觉，十分开心。而且不光可以益智，还可以健身，入手了健身环，justdance2020.每次玩完呼哧带喘。
最重要的是可以和朋友们一起分享游戏，多人游戏的感觉很棒！",2
页面不显示不能通外服，现在只有一个游戏单机玩，真的不值这个价格，退货拆封了也退不了霸王条款，以后不会京东上买东西了！！,0
"稳定性：不错
画面效果：很好
产品包装：没问题
流畅度：很好
运行速度：很好
外形外观：不错",2
国行烈士前来报道,0
就直接说吧马里奥U启动器，去买港版日版别想不开去国行坑。,0
这个关键时期在家不错的选择，东西不是很大，以后出去也可以携带，之前等了好久才收到货，没有让人失望，国行的就一个超级玛丽，有点单调了，期待以后可以出更多的游戏,2
发布会上宣布的三款游戏只有一款过审，等了这么久只有一款游戏怎么好意思发布的？,0
不能无理由退货，差评。不能与外服玩家联机玩游戏，差评。不能下载最新的游戏剧情和人物，差评。两千多就买了一台单机游戏机。国行**！！！！强烈推荐不买,0
很差的购物体验，买的游戏机+游戏卡+包和膜。为的就是省事儿，一起买。可是到货后只有游戏机和卡。没有包和膜，我心爱的游戏机一直在裸奔。客服说3～5天补发，可是都过去一周了，客服回复只是仓库很忙，要我再等。差评，我的游戏机还在裸奔....,0
"流畅度：流畅。
运行速度：还可以。
稳定性：暂时用着很稳定。
画面效果：掌机720P画质。
外形外观：挺精致的。
产品包装：包装比较一般！
应该说是一款很不错的游戏机，掌机和主机无缝切换，很有创意，非常方便。但是首发只有一款游戏，比较失望吧！e商店太可怜了，啥也没有。先和身边朋友借了几张卡带玩玩，希望今后游戏作品能及时登陆国行switch。总体来说比较满意！",2
质量好，外形好看，盒子都高大上。价格做活动的时候还不错，送货速度超级快，第二天到货，外形好看，包装也好，正品没得说。速度快，玩起来很流畅，稳定性不错，画质也很好，清晰度很高，买了一些游戏，小朋友都上瘾了，家里还抢着玩,2
就一个游戏 被骗了。 早知道看网上评论不买国行了。,0
商品外观好看，快递物流一流！就是不能联网开账号这个比较不令人不舒服，就只有一个游戏可以玩,1
非常好玩，就算只有一个游戏，也可以玩很久，宅家利器。还可以和女儿一起玩游戏，多了一个乐趣。至于只能完整版游戏，这是好事。因为游戏创作者也需要鼓励嘛，支持正版，支持慢慢玩游戏。这也是我教女儿玩游戏的重要目的，毕竟静心玩游戏也会有长进的,2
在京东买了这么多年东西，第一次这么认真评论。特殊时期被困在家里，临时决定购买，港行海外都时间太久，京东自营的国行，评价里显示好评的都是哪里来的？良心不会痛吗？国行的**货只能微信关联账户，只能上国行Eshop，里面长期只有一个游戏，腾讯N T M想干啥？京东明知道这种情况依然隐瞒实情来骗人，为了销售额连脸都不要了？唯一的一星是给京东物流小哥在特殊时期依然坚守本职工作的。,0
东西很好！游戏很 &ldquo;多&rdquo;，快放了一个月了！希望大家考虑好,2
垃圾国行版，买了个单机游戏。真想问为啥要出个国行版，有毛用啊，联网什么也干不了，游戏就能玩个超级玛丽？？？真单机,0
冲动消费，体验一般吧。,1
"国行战士出发。其实跟大家一样，在准备入手ns之后，都在犹豫到底是买海外版还是买国行版。综合考虑，我觉得对于懒癌选手非深度玩家，想玩一玩体感游戏，在家合家欢的话，国行是一个非常不错的选择。
流畅度：国行的机型是新的续航版，更新了处理器之后续航更强，功耗更低，在网速方面有腾讯国内服务器的加持，速度非常的快，无论是更新还是在线看一些视频都很流畅。
画面效果：机器本体的显示屏比较清晰。连接1080p的投影仪效果也很不错，虽然在精细程度上可能跟ps4有点差距，但是已经非常好了，可参照图7。
外形外观：ns的优势还是在于它的便捷性，无论是主机模式还是掌机模式都很方便，非常适合朋友聚会，家人一起宅在家里玩儿。经典红蓝色非常的有活力。
国行版的优势在于价格比较便宜，买的时候还有分期免息。唯一的登录方式是微信扫码很方便，而且付款也是直接用微信扫码，不需要国际版的各种繁琐操作。希望国行的商店能够快速的上架更多的游戏，目前来看会比国际版的卡带要便宜很多，希望多多打折。如果能有一天不限服就更好了。愿腾讯不负国行战士众望。",2
国行机器送货快，回家后女儿很喜欢。买来配合健身环减肥效果很好，电视、掌机、小游戏机自如切换，如果能有更多的国行游戏就好了，现在只能靠买游戏卡玩，不太方便。看腾讯什么时候引入更多游戏吧，马车8和奥德赛，期待中,2
马里奥系列是任天堂的招牌游戏。一直喜欢，主机包装比想象的大不少，配件很齐全，做工也好，目前只买了马里奥一个数字游戏，关卡超多，上手十分容易，现在打游戏的时间也少，支持一次国行，C口快充这点必须赞，以后就慢慢玩吧,2
回来就被闺女霸占了，我给三星是因为蓝色的一遍活动，我也懒得换了,1
这么说吧，本来是准备好当烈士了，但是给你的感觉呢，你顶国行，国行可没认为你是国行玩家，客服呢能做到有问必答，但是答非所问，官方用语太多，也符合TX一贯作风了，建议就是你有钱你随便买，否则国行将会让你后悔的不行，从预售开始，预售没有任何意义，就是个笑话，预定的人都知道，质保和没有几乎没有什么区别，限制很多基本用不上，联网速度快更没用，就一款游戏，最后各位烈士们加油,0
估计像我一样纠结买日版？港版？还是国行？的朋友会很多，毕竟考虑到售后问题还是选择了自营国行的京东，虽然目前的游戏还少，但玩日版的游戏还是没问题的，当然可能联网玩就够呛了，但个人还是喜欢单机版游戏。之所以选择任天堂游戏，相信大多数朋友就是冲着红白机时代的超级玛丽等游戏情结来的，我也惊叹超级玛利欧U的游戏能做的这么精致了，连接到60寸的电视画质清晰可见，而且可以同时2&mdash;4人一起玩。和孩子玩游戏也是一种亲子互动，孩子玩的也很开心。特有玩游戏的三种模式也很方便，抽拉式的手柄也很有创意，希望国行的游戏能尽快上市吧！,2
早晨下单，晚上就收到了，从别处种草了健身大冒险，就一发不可收拾。收到后马上玩起来，这真的就是我从小玩的超级玛丽，画面超级清楚，体验很流畅，无需下载插卡即玩，太爱了，接下来还要入手赛车，塞尔达，分手厨房，舞力全开。,2
产品没法满足使用，退货不行，换货居然偷偷给关闭，请大家慎重考虑！,0
"流畅度：很好
运行速度：很快
稳定性：稳定性好，游戏少了点
画面效果：很好
外形外观：很漂亮
产品包装：包装大气",2
和老婆一起玩的很开心，煮糊了，奥德赛都是不错的双人游戏。设备本身也不错，说什么国行无法联外网之类的，真的无所谓了，能和家人一起玩就够了。哈哈哈~顺便说一句，能看电视剧~哈哈哈~,2
"流畅度：很好，很不错
运行速度：很快
稳定性：很稳定，不卡
画面效果：色彩很好
外形外观：做工不错
产品包装：很严实，没有破损",2
"流畅度：非常好
运行速度：非常好
稳定性：好
外形外观：美观大方
产品包装：包装严实
画面效果：1080清晰可见
说一下国行问题。因为是成年人，买这个就是旅途中打打单机游戏，所以没有联网需求也不会重度沉迷。而且国行可以玩卡带，所以对于单机党是非常好的选择。至于游戏的资料片，大家扪心自问买过几个？ 国行有国行的适合对象，适合就是对的，对的就是好的。",2
玩了一段时间再来评价，只能说太棒了。孩子很喜欢，接上电视家人一起玩抢金币，马里奥派对小游戏，期待更多游戏上线。,2
就是一块砖，哪用朝哪儿搬,1
"非常好，完美！喜欢的不得了！开心死了&hellip;物流也快！在家终于有事情做了！
流畅度：卡塔一声安装方便、开机流程！
运行速度：速度很快，完美！
稳定性：wifi好就好咯！
画面效果：高清画面，完美！
外形外观：好看好看、马上买个好看的壳子！
产品包装：仔细，细致、正品的保证！",2
游戏机是被拆过的，不过疫情期间不影响使用就不折腾了。心仪已久的任天堂游戏机哝，就是健身环游戏涨价太离谱了。这样就ps4和switch都有了，游戏好贵但是在家好无聊。,1
流畅度：流畅度非常棒，家里人很喜欢，国行售后有保障，可以插外服卡带 真的非常棒。,2
我玩机子吗？游戏呢？这都几个月了？马里奥启动器？,0
吃灰神器,0
"画面效果：很清晰
流畅度：流畅
外形外观：帅气
运行速度：很快
稳定性：很稳
产品包装：精心包装
官方指定，质量保障，很可以的，玩了几天来评论，家很帅气，朋友聚会好帮手，家里必备啊。。。。。就是国行游戏少的可怜，相信腾讯，快快开发新的游戏，不过这三个想过全关也得1年的时间了。",2
"产品包装：外观跟我想象的一样好看，打开里面配件也很齐全
运行速度：打开游戏画面流畅无卡顿
一giao我的giao，怎么硕呢，第一次接触任天堂这款游戏机，一开机给我的感觉就不错，希望大家也可以多支持支持国产，多的话就不说了，还望各位帅哥美女们给我点个赞，毕竟点赞前三名可以白嫖游戏，谢谢啦",2
"本来没准备买国行，价格真的香。领取200的券后1649。
游戏有点少。希望塞尔达和健身环早点出国行。毕竟国行游戏便宜。
花19.9买了1000-50的分期券，结果免息不能用，还不能退款。引以为戒。
中评不是ns的锅。是京东的锅。",1
外面的包装盒子没有填充物，直接把机器就在里面晃荡，送人用的，结果这种卖相，失望，像旧的一样,0
我是烈士了,0
"流畅度：流畅
运行速度：绝对迅速，简直完美
画面效果：清洗",2
左边手柄要用松动。说送内存卡也没有发。不太愉快的购物。机子用段时间再来评,1
"流畅度：很少遇到卡顿，加载比较慢。
运行速度：读卡速度很快。
稳定性：目前没有遇到过闪退。
画面效果：高清马赛克的画质。
外形外观：飞机起飞的大黑边框。
产品包装：包装倒是可以。
不建议入国行，T讯的条款很霸道太饿心人了，犬是改不了吃像的，不应该以为T讯会变好，连吃相都不在乎了。以后是T讯的相关东西，一定要慎重考虑，能不用就不用。毕竟作风越来越像自由平等民主了&hellip;",0
不太建议购买，目前基本吃灰中，国行就一个游戏，生态圈目前有极大的问题,0
差劲，刚到手还没用右手柄就是坏，开机都开不了，退回维修十天了还没有一点消息，希望你们运气好点，不要买个坏的，这是我在京东第一次给差评，最差劲的购物体验,0
"运行速度：挺好的
稳定性：不错
画面效果：可以
产品包装：不错，没必要买",0
差评，国行就几款游戏，热们联网游戏都玩不了，说明不清，欺骗消费者，拆开了才发现区别，又不能退，最差一次体验，**！,0
预约购买一个星期，然后就降价！所以差评。国行真是毫无性价比，京东本单消费体验也极不好！,0
国行第一时间下单，凌晨下单，当天下午送到，非常快，就是游戏只有试玩，正式版还没配送到，先感受了一下试玩，机器比想象中的大，适合全家多人一起游戏，娱乐性很高，开箱连接激活都有指导，很容易，按图做就好，只是目前官方只有一个游戏，商场里没有其他的，有点无聊，希望后期尽快出游戏，游戏机配送包装很好，没有挤压，非常喜欢，值得购买,2
老板带头**的**公司，两千块买个**代理的空壳子，只有**一个游戏，还不给退，也不注明情况，***,0
腾讯垃圾，商店里就个马利奥。强烈要求退货。,0
东西不错，1星给京东，售后退换货各种麻烦,0
拆包后不允许退货～还叫什么七天无理由退货～,0
东西很棒，在这个特殊的时期里，闷在家这就是神器，一些犹豫买国行还是海外版的人要相信国行游戏卡会越来越多的，越做越好，毕竟刚起步嘛，支持,2
没有意思，没游戏玩,0
管他三七二十一 就是买 外服卡代撸起来 网速超快 很不错 现在正在肝大乱斗 就等国服其他游戏了,2
"流畅度：非常好，内置试玩版对于我这种手残党太难了，哈哈
运行速度：非常好
稳定性：海外版游戏可以更新，难道DLS不用钱吗？所以买唔买都无所谓。如果能跟海外账号联机就完美了
画面效果：冇ps4甘好
外形外观：非常好
产品包装：非常好。",2
"流畅度：很顺畅
运行速度：很好
稳定性：目前来看很好
画面效果：画面效果也可以
外形外观：还可以
产品包装：一般般",2
"&hellip;新买的机器，刚上手玩就发现手柄有问题。。。这质量。。。换个手柄浪费7天时间。。好在问题还是解决了。
本来想打3?
?
商店新上架了一款游戏&hellip;&hellip;这游戏e**&hellip;&hellip;
再扣1?吧。。",1
国行未免一点诚意也没有，真令人失望，一个多月就一款游戏！！！,0
"箱也开了 膜也贴了 包也试了 然后发现没事情干了
steam那样的商店比较爽，可惜switch没有
半个小时整个主机看了个遍
马里奥也不好玩
官方膜也不错，挺好贴的
单机卡带玩家[捂脸]
我发现没有游戏商店这个，真的不习惯
等着明后天二手风花雪月了。
不知道什么时候能用ns账号",1
"外形外观：刚拆开屏幕表面灰尘，任天堂品控就是差。
产品包装：收到包装盒都烂了。
流畅度：系统很流畅，游戏加载也很快。
运行速度：就一个游戏，运行速度再快也没用。
稳定性：等了一个月，就放了一个月，稳定性我知道个鬼。
画面效果：画质还行。
总体来说，就是买来吃尘，国行的游戏审核太慢了，一个游戏主机没有游戏就是没有价值。",1
"包装精美，迫不及待拆机。
非常期待国行版的设备。
希望游戏能同步的快一点，现在就一个游戏出品。
想了很久的switch，终于等到你了。
快递小哥服务超棒，要给他个赞?&hellip;",2
"流畅度：流畅
运行速度：很好 整体比较满意 
比较适合我 美中不足 入坑后 去全买卡了",2
机器收到了，挺满意的，虽然说游戏少，但我相信会多起来的，买了欧服的暗黑玩了几天，爽到爆，很流畅，不错，支持国行,2
"太好了，已购买商店全部游戏。
PS：2周后砸地上的声音特别好听",0
我是万万没想到，真的是数周内上架其他游戏，9??7 =63天，希望到到2月14号可以上架新游戏。买这么多东西，第一次差评。,0
终于等来了国行，很激动，相比海淘，购买方便，售后有保障。看了相关测评，各方面都很赞，果断下单啦。京东速度非常快，隔天就到了，包装严实。连接电视游戏体验非常棒，画面太美，流畅度一级棒，燃脂娱乐两不误，非常满意！平时出门掌机模式玩起来也很不错，买它！！！,2
"流畅度：非常流畅，玩马里奥的游戏完全不卡
运行速度：速度很快，好用
稳定性：不错。玩游戏很好
画面效果：很好
外形外观：挺漂亮的
产品包装：包装完好
缺点就是游戏太少啦，目前只有一个体验版的游戏，可以两人玩，有五六关。我最想玩两人对战跳舞的游戏，还不知道要去哪里买。",2
国行买错了，我是**,0
商城里只有一个游戏，事先没有了解商城这一块，这如果不熟悉网上查询资料的买家，不都是先开机根据提示步骤一步步完成才能进入到商场吗，然后进入一看只有一个游戏，购买体验太差，也没有明确告知目前只有一款游戏，京东上也是避重就轻的描述,0
"运行速度：非常棒！
稳定性：还可以！
画面效果：清晰！
产品包装：很棒的包装！
外形外观：漂亮，好看！",2
能玩的游戏太少,1
"流畅度：非常流畅。
运行速度：非常快速，响应灵敏。
稳定性：接电视玩了两个小时很稳定。
画面效果：画面非常清晰，色彩柔和。
外形外观：外观很好看？
产品包装：包装扎实，两层箱子，里面有塑料袋保护。
虽然很多人不建议国行，但是我觉得很好，保修也好，而且陪家人亲子欢乐。足够了。虽然现在游戏少，相信以后会多的。而且国内的网络速度快多了。希望更多的人加入进来。大家可以联网对战。最后表扬一下京东快递，非常快速高效。",2
"产品包装：第一次寄过来盒子都坏了。
稳定性：大家不要买国行，不能联网的，京东订拆封不能退货这个规定就是防止大家意识到这个来进行退货。这是我第一次中了京东的套路。不能联网的游戏机很多功能都用不了，一般好玩的游戏都需要联网。",0
客服回复很快，态度贼好，物流很快一天就到了，包装完好，无破损，机子无瑕疵，作为第一批国行勇士我感到很自豪，唯一的愿望就是，快点出游戏，吃多点，塞尔达，喷射2，健身环安排上安排上！,2
就一款游戏。完卡带还锁服。可以退货么？,0
"稳定性：一往如既的好，而且国行感觉更有保证了。
流畅度：跟以前的日版的都一样。
运行速度：很好挺不错的
外形外观：外形没有变化，跟日版，港版一样
产品包装：包装感觉应该被拆过后又打的国行的封条，应该是检查，机器没有问题
画面效果：很好，很清楚。",2
可以直接联到电视机上面这个惊艳到我了，运行游戏非常流畅，一点都不卡，画面效果也好，棒棒哒！,2
不建议现在购买，什么游戏都没有，买回去只能落灰，其他卡带不保证可以使用，而且只要开了外包装就不退不换。,0
期望越大失望越大，商城就一个游戏万年玛丽奥，京东快递不错，快递小哥客服不错！,1
跟买时的广告差太远啦！想想过年还可以一起玩马U，现在就一个蘑菇上线，不知买来干嘛，后悔冲动买了。,0
国行switch只能玩一个游戏，如此重要的信息不提示，是何居心，买了又不能退，对京东很失望。,0
流畅度很完美，没有卡顿。稳定性高，画面效果超赞，唯一一点，大家都不是很喜欢国产机，如果喜欢联机和要DCL的玩家还是建议买R版或者港版。自己玩个家人玩的话，国版够用了。,2
看到这么多差评我就放心了,0
第一天买第二天就突然升配置销售。不给任何补偿。,0
第一次差评，献给你！花这个钱买一个只有一个游戏的游戏设备？这真的太让人恶心了！关键账号还有限制不能下载外服游戏！超级差评！,0
就是一块板砖，拆开绝对退不了的噢，游戏商店里只有一个游戏，哈哈哈哈哈哈哈哈哈，那你还敢上市，良心不痛吗,0
"流畅度：流畅
 
产品包装：开封 
画面效果：绝了
 
运行速度：漂亮",2
稳定性：没游戏可玩，只有一个超级玛丽2d游戏，想买的考虑好了，不支持退换货,0
机器不错，可以只能镇宅用。,0
垃圾。不要买,0
谁买谁后悔,0
马里奥启动器都不知道买来干嘛,0
开箱发现那张封贴一半贴箱子，一半贴在送的擦镜布上，怕不是此地无银三百两。果然成了国行勇士。一没游戏，二不能联网跟人玩，勉勉强强玩个塞尔达，通关了就吃灰。,0
内存卡 ，游戏卡，机子帮我拆分了发货的，都被当作了赠品，由于长时间没发货误点了取消订单，客服说是赠品不能补发，我花钱买的为什么被当赠品发出？？？？？,0
可以的话我一颗星都不想给，连不了网络，只能玩局域网，外服更是连好友都加不了，更别提联机游戏了，而且拆封了就没办法退货，我这是瞎了眼信了腾讯的当。,0
千万别买国行版，买回来就是块砖，唯一的作用就是砌墙，一个月了，里面只有一个游戏，说是数周引进别的游戏，呵呵&hellip;&hellip;谁买谁后悔系列,0
买了必后悔，千万不要买，已经是国行烈士了，只有一个游戏我玩个锤子，赶快把腾讯告上315!,1
等了这么久，商店还是没有东西，一颗星给国行，一颗星给能插卡带,1
因为锁服，而且目前并没有后门，目前现有的switch联网对战游戏都玩不了。只能玩单机游戏而且无法下载单机游戏的dlc。送的体验版游戏只有6关，国服游戏只有这一个，目前来说非常非常不推荐购买。没有买日版合算，听说现在海外版网络连接变好了甚至可以直连，有待考证。,1
东西很不错，掌机里边的王者，五星好评，推荐给大家。感觉国行也可以，逐步向好,2
用着良好，就是这个散热器这里容易看到铜板子，感觉像翻新机一样,0
国行勇士，买了没游戏玩，买了卡买不了dlc，连不了网，说数周数周，都90天了，就一个马里奥U，对得起国行玩家的信任吗，算不算欺诈消费者,0
"画面效果：非常好，清晰度也高
外形外观：大气，有现代感
运行速度：很稳定",2
"感觉质量确实如网友所说&hellip;我买了几天来着？
游戏也跳水&hellip;",1
0点下单，下午就送达了。太给力。和老婆直接开始玩起来。各方面都不错。支持一下国航。马里奥现在就体验版6关。很欢乐。找到了以前童年的感觉。哈哈?,2
等了一个星期才收到货，玩的时候发现游戏手柄附件插槽有错位，告知客服可以换货但是又要等半个多月。效率太低了吧,0
手柄与主机松动严重！！要求退货客服只会说&ldquo;这正常，都这样。不是我们质量问题不能退&rdquo;   相信国行才买的这家店，倍感失望！大家还是放弃这家店吧我想问,0
我是真的傻了，都28号了，还是一款游戏,0
保护膜有划痕，粘贴好以后很难看。,1
同货不同价，2099和1950两个价，杀熟。,0
