comment_sen,score
买了差不多两个星期了，游戏机插进主机盒有点失灵,0
瑕疵版switch，屏幕里有灰。客服说是正常现象。不影响使用。我觉得像换的屏幕。买来送人。货像二手。店家开心就好。总之体验极差。没有下次了,0
没游戏玩可太难了。。,1
我是国行勇士我怕谁！！！哈哈，本人奔四的奶爸一枚，家中已有PS4 Pro，老年党只能玩玩单机游戏，所以对联网没有太高要求，买国行主要考虑保修方便，在京东买了延保，直接放心造，以后游戏多了如果要联网玩网速也有保证，目前都是马**买的卡带来玩，可以正常更新，健身环大冒险很不错，又可以健身又不无聊，强烈推荐！推荐****入套餐，比买裸机划算。,2
等了几天就给我发了个二手货过来这波操作属实有点下饭,0
收货手柄就坏，腾讯的客服虚无缥缈。,0
京东发货速度很快，机器试玩画面效果挺细腻，清晰度，色彩也挺好，流畅度很顺滑，机器运行很流畅，没有卡顿，产品包装防护很到位，外形自已比较喜欢，手感也挺好，比较满意的一次购物！,2
"流畅度：很不错
运行速度：老任的游戏没那么吃硬件，目前玩儿的游戏都很流畅
稳定性：目前没有出现过什么问题，还算稳定
画面效果：掌机模式720p，够用。主机模式1080p也够清晰了
外形外观：东西已经出来好几年了～要说经典也可以吧
产品包装：包装盒扔楼道，隔壁小孩馋哭了",2
国行真是啥也不是，买了两个月了，硬是没游戏可玩，真的是被骗的入了国行的坑,0
物流非常的给力   第2天就到货了   浓郁的咖啡气息和香浓的牛奶搭配起来真是太美味了   还送了一个杯子的  真心的不错  想吃 喝完了还会回来自由搭配 这种口味   总之这是一次完美的购物体验    给点个赞吧,2
快递是非常的快，疫情期间，两天也就到了。国行的机器，有一年质保也是蛮好的。里面内置了超级马里奥，不过只有6关，先玩着吧。等我的塞尔达到了再好好玩它。本以为连电视的画质会比PS4差很多，但是没想到效果非常的好。希望腾讯赶紧多出游戏，卖便宜点。,2
"流畅度：很流畅
运行速度：非常快
画面效果：720p还行
外形外观：经典，不用多说
产品包装：买的套装，划得来，包装很好，腾讯出品
           人身的第一个游戏机吧，从小到大也喜欢玩游戏，一直想要个游戏机，首批国行ns用户，想体验一下在掌机玩游戏是什么感受，预装的游戏也很好玩，后面等其他好玩的游戏上线了再买",2
"太快了！实在是太快了！晚上下的单，第二天早上就到了！京东快递就是NB！
外形外观：外观干净，手感很舒服
运行速度：速度流畅不卡顿",2
"开机红，并且带个试玩版的马里奥，还可以。物流也是一如既往的快
差评是给包装的。收到货的时候塑料袋是破的，还安慰自己只要包装盒没事就行，结果拆开一看盒子前面后面都有大的破损，肯定是被硬物硌的。电子产品有你们这么弄的！？",0
他么的国行就是赤裸裸的欺骗。啥游戏都玩不了，就个马里奥，也好意思拿出来卖，等我们买游戏卡插上去发现玩不了，拆了不能退，我花两千买个游戏机来玩马里奥的？大家看清这骗钱的嘴脸！！！希望这个评论不要沉，我之前翻了很多评论都没有写到国行不能玩的！,0
"就一款游戏玩个毛啊！退货！但是我已拆封，又不让退！就是**公司！对京东也是超级失望！
商品描述里就没有介绍只有一款游戏！
最差的一次购物体验！
预**",0
"运行速度：很好 用起来也很舒服
画面效果：还可以吧 投到电视上很舒服
尴尬的就是joy_con遥感有弹簧声，看网评原来是个任天堂的通病，虽然玩着不舒服，还是忍了吧",2
谨慎购买吧！游戏太少了，虽然之前有心理准备，但是游戏并不是那么好玩，我就是随便买的，因为无聊。其实准备买ps4的，但是懒得弄屏幕，所以就买了这个，希望塞尔达能好玩一点。,1
非常好。特别喜欢，物美价廉值得购买，就是游戏不多，还可以，包装很好，物流很快，特别满意。十分好评,2
新出的品控真的不太行噢，我的手柄有划痕还松动，售后还不退，推来推去的，要被恶心死了,0
"流畅度：系统很流畅，便携玩游戏就是爽。英伟达的处理器性能有保障。
运行速度：玩游戏还不错，配合老任的游戏，基本没有卡顿。
稳定性：试玩几把，国内服务器很稳定，游戏机也很稳定。
画面效果：显示720P分辨率屏幕，不过不影响使用，老任的游戏，向来是游戏性第一。
外形外观：比想象中大，便携性还不错，反正能带出门。
产品包装：包装红色超级漂亮，中国红的感觉，很喜庆，当新年礼物送人绝对棒棒的。",2
"流畅度：挺好 挺快的
运行速度：没问题
稳定性：还好
画面效果：很清晰 接入大屏也是
外形外观：红蓝cp
产品包装：emmmm",2
很棒产品，发货速度快，国行有保障！游戏老少皆宜，一家人玩的不亦乐乎，很不错，加油！,2
鼓足了勇气当烈士，没想到体验是这样，寄过来个牙膏箱子，首页说给的赠品告我增完了，增完了不删，误导消费者,0
"流畅度：很好
运行速度：很快
稳定性：无明显问题
画面效果：一流
游戏只有一款可以下载，三百大洋。然后就没有了。果断选择退货",1
不值得买，游戏太少（目前就一款），不如去买其他版本,0
"流畅度：非常流畅
运行速度：快
稳定性：不错
画面效果：挺好
外形外观：外观没什么都一样
产品包装：挺好
京东物流没的说  上午下的单  下午就到了",2
挺好的，299玩商城所有游戏！大家快来买呀 &hellip;&hellip;嗯 除了没游戏，其他都很好，相信游戏会越来越多的，以后国行会是主流，就怕以后腾讯来个首冲送超梦碎片,2
"流畅度：完美无缺，非常棒的游戏体验
运行速度：无与伦比的流畅，国行精品
稳定性：一如既往的稳定
画面效果：惊艳的画面，配合荣耀X1电视非常棒的
外形外观：精致小巧，外出携带很方便
产品包装：完美无缺",2
送货速度超快，用过后再评价,2
"外形外观：买完才知道 防伪标上面有字母是拆过的啊
这次有点失望 送货很快 收到二手机有点不爽，应该是摸摸党摸几天退了 太倒霉了",1
目前只有一个游戏只有一个游戏，开箱不支持退货！开箱不支持退货！我快被媳妇打死了！慎重买！！,0
纯粹骗人的，就一个游戏，商城也没东西，谁买谁上当，就骗不懂得小白，你买了就等于买了一块砖，还不让退货，第一次见。,0
品控是真的差 后盖居然有点翘 不影响使用懒的换,1
千万不要买 几个月了还是一个游戏 谁买谁倒霉?,0
千万不要买国行，真的只有一个游戏，不能联网，不能DLC，我真的真的真的真的后悔了,0
专门为了健身环买的，和老婆一起在家里健身，省去了去往健身房的路程和时间，也比单独在健身房训练多了很多趣味性。重点是非常方便，随时有时间都可以练上一小会儿。偶尔朋友过来，还多了一个客厅娱乐项目，希望国行也越来越好，游戏越来越多。,2
千万不要买国行！不能和日服港服所有的其他服进行联机，不能购买数字版游戏，账号都是单独的，不是国际服，不能更新dlc，一共就3个游戏？你在逗我，ns只能玩3个游戏，你买了游戏就永远没有更多的内容，人家都在更新新内容，你永远都没有，而且锁服,0
国产游戏机的游戏太少太少了，不能玩想要的热门游戏,0
"流畅度：流畅
运行速度：快，按键反馈很好
稳定性：很稳定，操作很快
画面效果：画质优秀！
产品包装：惊喜！看到那么大的快递惊呆了！
外形外观：很棒！",2
经常在这买东西，目前还没有失望过，棒棒哒！一次很好的购物体验，服务周到，物流快速，配送也很周到，态度也很好，好评！一直在这购买，质量有保证，总之非常好，五星好评！现在东西基本都在这买，已经成为习惯了，又快又方便，服务还好，价格很实惠,2
为什么我买了三天降价50块钱，这个钱给我反吗？,0
"流畅度：流畅的像风一样自由。
画面效果：它美的像花儿一样艳丽。
外形外观：它红蓝双色经典永流传。
运行速度：它运行起来那风驰电掣的感觉。
稳定性：它稳如泰山，(((&phi;(◎ロ◎;)&phi;)))
产品包装：它精美绝伦馈赠佳品，老婆大人夸我好！
来了！它来了！！国行主机配上健身环大冒险，香！真香！真香啊！！！",2
"心心念想要买个主机，在任家和那两家之间犹豫了一下，决定买任家，毕竟赶上国行刚刚发售，也算趁热。买来之后试玩了一下，觉得自己的选择没错，任天堂游戏的可玩性是真的高，可以跟朋友一起玩儿，已经很久没因为玩游戏而哈哈大笑了。
再说画面，真的是当做主机买的，因为是高龄上班族，在家玩游戏的时间比较多。在电视上的画面真的是比掌机好太多。
再说游戏。目前国行只有一个游戏，马U，很好玩儿的但确实是太少了。决定以后出游戏慢的话就每月入一张卡带吧，联网需求不高的优先。等等党一定会胜利，嘿嘿。",2
"产品包装：产品包装就很可了，红色大盒子，礼物包装即视感。
运行速度：运行速度非常流畅、稳定，画质清晰。
画面效果：不得不说，游戏界面的画质实在太好了。
外形外观：红蓝手柄的配置，真的是美呆了，配色非常喜欢。
流畅度：游戏运行非常流畅！
稳定性：稳定感十足，非重度游戏患者，游戏足够用了！",2
客观的来说，第一次入手任天堂NS，算是小白了，不懂国行/日版/港版这些机器的差异，网上简单搜了下，国行机器保修方便，觉得蛮好就入手了一台。入手之后确实方便，机器很新，外观很好，还有马里奥试玩版。好了，后面我要说重点了&hellip;&hellip;&hellip;&hellip;后面就是没有然后了，然后&ldquo;国行&rdquo;机器商店里就一个马里奥，是的没看错，就一个游戏，拜托这是商店&hellip;&hellip;然后没了。我还买了200G-SD卡，想想都好笑，现在同款机器还在促销降价200块&hellip;&hellip;如果有朋友再买NS，我一定不会选择国行了。惊天大坑&hellip;&hellip;,1
感觉被骗了！只有一个游戏，还不能退货！买东西以后一定要看差评！,0
就是一个坑，最好别买,0
才买了6天  就出了优惠套装  纯粹恶心人来了  差评,0
没游戏，没游戏，没游戏，不要买，不要买，不要买,0
这款游戏机一直期待了很久，终于等到活动的时候果断入手了，性价比很高。质感和手感都是非常的棒，上班在地铁上可以很方便娱乐一下，在家休息连接电视上玩更是刺激，总之是值得入手的一款游戏机。,2
我也是纠结了好久，才决定买国航switch游戏机，同时选择买了豪华版卡丁车，昨天晚上7点，京东物流送货到家，以为回很麻烦，结果一试，安装相当简单。先试试手，就一使用版画面都这么流畅，运行速度也快，画面生动，一下就把玩家带入其中，只可以目前国航还没出健身环大冒险和打球射击类游戏。,2
心心念的NS 终于入手了，非常满意。支持单人和多人 同时游戏。这次京东活动力度非常大，还支持24期免息。  非常赞！红蓝机非常喜欢，跟家里人一起开心的游戏，每个人都笑的像个孩子。,2
只有三款游戏？看差评我还不信，买了我后悔了，怎么能玩别的游戏？,0
一个月了，就一个踩蘑菇&hellip;&hellip;真把支持你们的国行玩家当傻子呗？游戏没办法过审我们能理解，后门不给开那真的是你们的问题了&hellip;&hellip;没有dlc游戏体验差得一匹！,0
还好，没有游戏卡，已经躺了一个多月了。,1
没游戏,1
除了能玩国行马里奥，其他卡带都不能保证能读的出，朋友们注意这个，不保证哦，那等于你两千多只能玩一个马里奥哦！要退货那是不能的，要换货七天内也不行的，只能让你寄回去维修，你修吗？！七天不到的机器你想修？！奉劝各位真的别买，买了生气！欺客！国行不保证其他区的卡带能玩，就凭这点，你买这个干嘛？！,0
不太建议购买国行，目前只有一个游戏。19年12月说的数周推出多款游戏，到现在2月27号还是只要一款，有欺骗消费者的嫌疑。另外其他版本的卡带很多功能玩不了。,0
腾讯国行版，不能联网，不能关联海外账号，商场只有一个游戏，不能更新，不能买dlc，只能单机，慎重考虑呀大兄弟们,0
看了很多网上的说法，选择了国行版。到手感觉喜滋滋。一年保修还是很符合自己的购物需求，毕竟对电子产品不大懂，心里踏实点。送货也很快，只是下决心买的时候，内存卡套餐已售罄，略遗憾。,2
商店只有一个游戏，开封联机才知道，纯小白，也不能退货，就一个砖块，建议不要入手目前。,0
"流畅度：不错，超流畅的，就一个游戏不流畅那是不可能的
运行速度：快快快，难受wifi不是太好，在卧室里玩就两格信号，充电时再看就一格信号了，不知道是不是都这样
稳定性：最新系统，体验版测试了下还可以，游戏过审真心墨迹，看来有必要先买个卡带玩着了
画面效果：画质清晰，不错不错，完美
外形外观：第一次玩略感稍大，有必要再入lite吗？
产品包装：就一层袋子，还很好包装就凹进一点儿角，里面完美，总之，国航套装版感觉还是挺香的，单机本地联机偶尔玩玩挺好，bilibili看了不少大神评测，感觉不是游戏党不在乎外服联机的，完全可以入手国航，本人也是和朋友偶尔一起玩玩，又入了pro手柄，唉，12期真香，哈哈哈哈哈哈哈哈哈哈哈哈哈哈哈哈哈哈哈啊哈哈哈哈哈哈哈，凑字数别在意哈",2
"产品包装：京东物流非常迅速，隔日就到货了。外包装厚实到货完美，八角尖尖，点个赞。
画面效果：开机后，画面细致，设置完后直接玩了游戏，运行十分顺畅，没有卡顿出现。
外形外观：买的国行是蓝红款，算是挺传统的配色。按键触感反馈感觉很好很舒服。买的套装，包质地很好，200G的卡也很超值。体验很不错哇。
之前玩过外服的机器，没什么限制挺好的。自己算是个轻度玩家吧，对网络互动要求很低，国行的机器硬件都是一致的，游戏本身不受限制，想玩其他游戏的话就去买卡玩就好，很方便，都可以玩，更何况还有那些N合一的移动卡。国行保修很方便，这点省了不少事情。而且随着时间推移国行的游戏会更丰富，更符合标准，至少不会出现捡树枝的红线之举。游戏机嘛，能玩，开心就好～",2
泡面压砖不错,0
switch很棒，无论是独立玩还是连到显示器玩。,2
垃圾国行，千万别买，2000多三个游戏你敢信？而且超过天不能退货，只是看了一眼，摸了一下而已，真就金子做的呗？,0
"国行烈士在此。。。
实在是看不到一点点希望了。",0
只有一个游戏，不能DLS，买来只能单机玩，不支持7天无理由退货，差评。,0
"流畅度：很好
运行速度：很好
画面效果：很好
外形外观：很好
产品包装：有破损
东西整体不错，对于我这种极端休闲玩家，完全能够满足，赶上活动买了2199的套装也确实划算，希望后续游戏能多搞点活动吧，多出一些休闲类的游戏，我们这种中年人已经肝不动竞技类了，哈哈",2
"外形外观：很喜欢的样式，红蓝很漂亮
产品包装：很完整，很简洁
流畅度：待试玩再来评价
运行速度：待试玩再来评价",2
作为提前预定多日的用户，感到很气愤。预定时说10号零点付尾款，但9号晚上开始，没预定的用户反而可以直接下单购买并开始物流流程。预付定金用户不仅不能退款，反而要多等几小时，导致不少预付定金的用户，套餐商品缺货。不知道这种低级错误为什么会发生，在向客服咨询时也只能得到一些官方的套路答复。如果这就是你们Nintendo和~在京东开店的经营水平，建议趁早下架，毕竟机器现在也只有一款游戏能玩，作为一款上市已经近三年的掌机，上市后居然只有一款游戏可以下载，不知买到手的玩家作何感想。我对我的言论负责，目前外卡缺失一切任天@上联网功能，包括DLC下载，且无后外卡续优化通告，造成目前全锁服半锁区，整款游戏机仅有一款完整版游戏能玩。,1
国行只能支持卡带不支持领金币和其他操作，还是买港版或日版比较划算，希望大家引以为戒,0
"流畅度：国航就是好，下载速度飞快再也不会突然卡住了，还有腾讯加持保修一年；
运行速度：任天堂出品必属精品，大型游戏轻松运行，玩游戏特别爽；
稳定性：平稳运行游戏，玩游戏一整天也没有崩溃；
画面效果：显示效果细腻，动作特效流畅，给我不一样的视觉冲击力；
外形外观：游戏机不仅可以手持玩还可以在客厅连电视游戏，贴上新买的贴纸感觉酷炫无比。",2
心心念念的switch终于入手了，非常喜欢。买之前在日版，港版和国行之间犹豫很久，最后还是决定买国行的。事实证明，如果和我一样非重度玩家，不喜欢线上对战和买DLC，只喜欢玩卡带的，非常合适买国行，支持所有版本的卡带，手柄一分为二，两人一起玩，更加有趣。,2
"画面效果：画质好，清晰
产品包装：包装整齐，运输无损坏
运行速度：掌机对于80后更多的还是情怀，今年趁着生日，给老公买个NS 当礼物，更多的时间还是花在家庭和工作上！收到就开始玩了，总之机器很正！客服很棒！送货很快！以后国行版出好游戏依旧会买！",2
就一个游戏，3个多月就一个游戏。奥德赛，马赛，塞尔达一个都没有！你卖什么游戏机，你这跟咋片有什么区别！,0
心心念念的Switch终于到手啦！拿到机后超兴奋，急忙开机试机，屏幕够大，边框也够宽哈哈。预装了一个超级马里奥兄弟U试玩版，不错，很流畅，也很快容易上手。不敢说自己是任天堂的老玩家，之前任天堂家族的主机也只玩过Wii，现在玩最新的Switch主机，还是能感受到任天堂游戏塑造的轻松游戏氛围，玩起来也不累。我几乎不玩网游，但整日坐在电脑前玩Steam游戏，还是怪累的，这下就好了，在床上躺着玩都不是问题啦！最后还是感谢京东这次的24期免息，也圆了我买Switch的梦想！,2
垃圾，没有几款游戏,0
"流畅度：很好
运行速度：非常快
稳定性：用用再说
画面效果：非常棒，很细腻
外形外观：很nice
产品包装：很好，很安全
产品很惊艳，做工很好很棒！刚拿手上测试了下，操作很方便，造型独特，大小合适，还可以连接电视、爱不释手啊！希望后期游戏卡能有优惠！后期体验后再发表评论吧！
给儿子买的，儿子很喜欢?和儿子一起玩，非常棒?",2
买来可以当传家宝，因为你玩不了几天就只能吃灰了！,1
"流畅度：很流畅，玩儿游戏很爽，手柄振动反馈很赞，这样打击感碰撞感会很真实很立体。
运行速度：毕竟是专门玩游戏的机器，速度很快，卡带更新数据也很快。
画面效果：画质分辨率好像是ns饱受诟病的地方，对于我来说还可以接受，就是屏幕反光这一点不太爽，光线强一点的地方就有点看不清画面。
外形外观：喜欢这个外形，科技感和萌感都有，红色和蓝色是很好的颜色。
产品包装：合家欢亲切感的包装盒，不是电子产品那种颗粒感十足的高冷的包装，就像是超市玩具货架上的那类盒子。
最后，塞尔达真的好玩。",2
"流畅度：运行流畅，试玩马里奥很好，没有延迟卡顿。
运行速度：运行速度很快，下载游戏速度也很快 。
稳定性：很稳。
画面效果：画面细腻，链接电视也可以用1080P。
外形外观：方便携带
可以使用其他地区卡带，配件也全部通用，不能登陆外服。 希望快点出健身环大冒险。",2
换货后正常，做工品质有待提升，第一台游戏机，感觉一般般,1
"真坑die，收到货才发现，国行商店什么游戏都没有，没有游戏可以玩，问客服都不允许退货了，商品详情里面也没说不能链接国外的服务器，也没说只有一款游戏可以玩，建议大家不要买国行，现在想处理掉都没人要，买了个砖头回来，气死人。。。。。。。。。。
流畅度：垃圾
运行速度：垃圾
稳定性：垃圾
画面效果：垃圾
外形外观：垃圾
产品包装：垃圾",0
"首先商家以不拆封作为七天无理由退货的前提条件就是霸王条款，商家为了控制退货率竟然出现只有国行才有的封条。其次京东作为平台竟然可以让商家有这种操作，同是天猫并没有这样的条款，完全没有站在客户角度考虑。
最后作为很多对产品不了解的客户由于对产品实际情况的不知情导致买错的情况，作为商家个平台应该支持不影响二次销售的情况下去给客户退货的权利，这也是无理由退货的初衷吧。
游戏机本身并不做评价，希望腾讯能做的比说得好吧。",0
"流畅度：自己玩起来非常流畅, 但是投屏到电视上面就会出现非常明显的延迟, 所以大屏和0延迟其实是两个互斥的选项
运行速度：机器跑游戏当然没有问题, 也不会出现卡顿
稳定性：很稳定, 玩了一个多月了目前没有出现问题
画面效果：画面效果很好, 缺点就是没有游戏! 我买的是一个正版游戏机! 不是一个马里奥兄弟机! 再没有游戏恐怕就只能差评了!
外形外观：标准的高级的外观
产品包装：包装很用心, 送货很快, 很方便",2
买了不到20天 有杂音   有问题 可以修 但是这售后让人恶心    关键买了不到20天   还有 希望你们的客服尽快电话联系我,0
流畅度：目前运行还是不错的，插了张256g的卡。可惜的是在线商城目前就只有一个游戏，希望多上架更多的游戏。直接扫码购买很方便，避免无用的包装之类，数字化很方便。红色的壳子蛮漂亮。新机现在适应中，期待更多游戏。,2
真香，收到之后很惊喜，质量很好，游戏目前只有一个，期待快点更新，想玩宝可梦剑盾，塞尔达等等，超级玛丽也很好玩，入手的第一个主机，算是完成了儿时的遗憾，希望这个机器可以陪伴我度过艰难的时光真香，收到之后很惊喜，质量很好，游戏目前只有一个，期待快点更新，想玩宝可梦剑盾，塞尔达等等，超级玛丽也很好玩，入手的第一个主机，算是完成了儿时的遗憾，希望这个机器可以陪伴我度过艰难的时光,2
质量很好，手感不错，续航能力得到有效提升，关键是整机，配件1年质保，值得信赖,2
东西非常好，主要的是配送的速度真的很快，上午下单，下午就到了，真的是让人很开心的一件事，每天都玩，找回咯小时候的感觉，不过要买游戏卡又是一种投入，不过只要玩的开心就好了,2
"流畅度：流畅呀
外形外观：真的很酷
画面效果：画面清晰，简约，我喜欢深色主题
产品包装：观赏性强
打开包装，非常惊喜，switch国行来了，相比之前更接地气了，哈哈！第一次买，相信国服游戏上架很快，毕竟是合家欢，容易过审的，力挺(? &bull;?_&bull;?)?",2
"产品包装：包装挺精美的，也都挺齐全的
运行速度：运行速度比较快，还挺不错的，操作起来带劲
流畅度：玩游戏的时候游戏玩得还挺流畅的，不卡顿，会让人玩得很爽
稳定性：稳定性很好，还挺符合自己的期望值的
画面效果：画面效果清晰，看着比较舒服
总体来说，确实比较满意！",2
物品没有损坏痕迹及划痕，整体个人感觉是正品。使用起来，比较顺手，简单易懂，画面质感和音效及动感很不错！！,2
"刚刚拆开快递就来评价了
画面效果：很不错 特别是连着jc的感觉
外形外观：没问题 红蓝很漂亮
产品包装：京东物流nb 
希望国内游戏快点上线 希望越来越好
再来一句 jd快递真厉害",2
才买几天就以优惠券形式掉价，还没保价！厉害,0
发货很快，机器很赞！最终选择国行，虽然现在只有三个游戏，但是相信在腾讯的运营下会越来越好，等游戏多了，国行网络稳定的优势就出来了,2
