comment_sen,score
手柄，做手柄摇杆有很严重的弹簧声，然后国行的游戏还是不是太多希望之后会完善，然后这个手柄做的非常不错，所以是这个游戏机比其他两个都好玩，也有体感陀螺仪，希望国航可以出更多的好游戏，联网功能以后也可以免费。,2
"流畅度：不错的，系统稳定流畅
运行速度：游戏都是针对机器专门匹配，运行没压力速度快
稳定性：运行稳定
画面效果：幕分辨率不是很高， 效果还行
外形外观：机器外观设计新颖，多种组合方式和玩法
产品包装：色包装盒很亮丽喜庆， 包装比较稳固。
       关注这款游戏机很久了，国行首发就立即约定购买，目前国服商店只有一款游戏，希望加快游戏上架速度。机器的可玩性丰富多样，支持国行！",2
啥都不说了，烈士，要求全额退款，,0
心心念念的游记机到了，算是给老公的2020年的礼物吧！让他开心开心，买个健身环，以后也可以锻炼身体用，特别满意，就是膜，来的时候就有一道折痕，影响了拍照的美观，对付贴上了，总体是满意的，京东就是给力，头天买，第二天就到了，就是这么给力。游戏画面非常的，投到电视上玩也完全没问题，小巧灵便，可以走哪里玩到哪里。,2
京东10年会员，第一个差评就给你了，还**是情怀类的。12月10号首发到现在，就一个游戏。你这是卖游戏机么？这**是抢钱啊，坑的无底线。,0
就是个坑，买到手三个月了只有一个游戏，还不能联网，全都是虚假宣传，正在投诉维权中，大家不要继续上当受骗了,0
试玩了几把，这游戏机不管是外型还是流畅度都无可挑剔，过两天再买两个游戏，完美,2
已退货,0
谁买谁沙币，对，我就是沙币。???,0
目前国行版只有三个游戏！希望加快更新更多游戏，玩起来还算流畅！但是刚刚收到快递发现外盒被打开过再封上的，问了快递说商家给的就这样！,1
腾讯呀腾讯呀你可终于把广告改了，3星给你的知错能改的态度，但还是只有一个游戏,1
"流畅度：玩了健身环大冒险，舞力全开，分手厨房，插外卡完全不卡，更新也很快。
画面效果：连接到电视上，玩游戏太爽了，特别是舞力全开，超有感觉。
运行速度：运行目前没有出现任何卡顿，多人游戏这完全没问题
稳定性：国行系统运行稳定，网速也不错，希望能有更多游戏。
外形外观：选的是经典红蓝色，每次滑入左右两个手柄的咔嚓声，特别治愈
产品包装：产品包装完整，三码合一，开口处有封条。",2
灰的，也挺好看，游戏机嘛，充分利用就好啦。手柄很紧，多出游戏吧老任！,2
差评，国行没有游戏玩。真没意思。,0
"流畅度：非常流程，无卡顿
运行速度：运行快捷方便
产品包装：包装完美，封条完整",2
"产品包装：外包装很结实，很完美
流畅度：没话说，等待更多游戏出来，测评
外形外观：有一个手柄有点松，问题不大
运行速度：没话说，很流畅，手感很棒
稳定性：没话说
画面效果：极精细，连投影玩爽爆",2
在京东购物这么多年，拿到货欣喜若狂拆开马上拿来玩，拍了好多照片等着写好评，手贱点开了订单里的商品发现尽然更划算了！！第一次心情这么差。东西是好的，活动太差劲，才买拿到手就更划算的活动出来，因为拆开了不支持退换。也没有保价活动，一切来得太突然，我还没来得及反应。。。。,0
到是很满意的一次购物了，本是pc玩家，关注国行switch也很久了，虽然说之前在网上也看到很多关于国行的负面评价，但是最终还是买了。什么国行勇士国行烈士？我还真不是，对于我这种主玩pc的，steam花个四五十玩个巫师三还是很香的，买switch主要是和家里小孩一起玩，没什么联网和dlc的需求。如果和我差不多的，可以考虑这个国行。需求不同，我建议还是别买国行，毕竟dlc和联网确实挺重要的，毕竟几款经典游戏联网才有意思,2
这都一个月了 说好的数周内上游戏呢？这数周要到什么时候啊？京东第一条差评 过了一个月来评价的,0
垃圾国行不懂 买了就后悔,0
"国行switch就是便宜，用某夕夕的价格买了京东自营的商品嘿嘿。
看我头像和昵称，你也可以买的便宜很多，别说我没告诉你嘻嘻。
言归正传，国行switch除了游戏少，别的没得说，流畅好用的很，前两天系统更新了，感觉新游戏要来了，现在买还多给一年的延长保险，真的太值了！",2
正值switch海外版本受全球疫情影响价格节节攀升之时，果断下手国行版，不考虑国外服联网，玩各种卡带无问题，马里奥赛车玩起来国内服务器速度更稳定，很多人纠结的国行版其实也没那么鸡肋，个人还是推荐入手。,2
"流畅度：挺流畅的
外形外观：还可以
产品包装：也还可以
最主要，游戏游戏游戏游戏游戏游戏游戏游戏游戏游戏游戏游戏游戏游戏游戏游戏游戏游戏游戏游戏游戏游戏游戏游戏！",2
听闻switch国行版出来，心里一直蠢蠢欲动，买还是不买纠结了好久。最后还是控制不了我自己乘着双十二买了下来。还是为了满足那份记忆。也为了圆自己**候玩的不过瘾的遗憾。东西送到第一时间打开。眼前一亮&**ash;-漂亮。双手拿起手感舒适。使用起来手速灵活。运行流畅。接上大屏幕更过瘾。简直完美。好评。,2
主要是想要晒单抽卡，但是机器确实不错，保修卡的什么都齐全，机器里面的试玩版玩起来分辨率和帧数都很棒，序列号也上网查了，总的来说很完美的购物，但是我想要卡啊???,2
还是非常喜欢灰色的，经典耐看，任天堂的游戏机简直逆天了，值得人手一个，童年的美好回忆,2
"流畅度：流畅度很好，不卡顿，续航版的电池果然更持久。
运行速度：开机很快，运行速度很稳定。
稳定性：稳定性很高，不会出现闪退的情况。
画面效果：画面效果很好，明暗度，对比度都OK。
外形外观：红蓝配色经典大气，很好看。
产品包装：产品包装很棒，外包装没有磕碰，腾讯的封条很牢固。",2
第一次给差评，东西不错，就是这快递是真的恶心人，走走停停，一停停一天，顺丰能送的它京东说封路忽悠人，一开始客服说下单过后会显示送达时间，一开始显示2号送达，我想春节疫情期间等个四天也情有可原，后来提示都不提示一下直接改成显示七号送达，跨过购物也差不多到了吧，快递这包装也是没谁了，期间其他店铺买的手柄和卡带都到了，愣是死等这快递，难受,0
"买给儿子的六一礼物，小朋友期待了很久，小学二年级作业不多，还能每天玩会。 小朋友没有联网要求，买了国行单机。
六一凌晨下单，当天送达，国行商店下载了两个游戏，还有一个体验版，又买了马里奥网球和健身环大冒险的卡带，还有一大堆体感游戏配件，小朋友每天玩的很开心，梦里都在玩游戏???
一直信赖京东自营，服务和配送都是一如既往可靠。",2
"流畅度：非常顺畅
运行速度：很快
稳定性：很稳定
画面效果：清晰
外形外观：很有创意
产品包装：牢固结实
这款switch是作为6-1礼物买的，还买了健身环，使用效果非常长好，游戏中可以锻炼身体，不知不觉就流了很多汗，国行机器有质保，期待推出更多的游戏，信赖京东自营产品，满意",2
真的巨差的一次购物体验，这么贵的东西包装就一个袋子，真的大家千万别买，去哪买都行别来这买,0
里面只有四款游戏，每款游戏还要单独付费。,0
在京东上卖国行switch真的是害人 除了国行 哪个版本的switch也不锁区 把我害惨了,0
"流畅度：无论是掌机模式还是主机模式，游戏运行流畅。
画面效果：画面清晰一流，玩着马里奥部分2D场景，仿佛回到了童年。
外形外观：产品包装良好，主机套件散发出一股清新的电路板味道
希望国行越做越好，国行游戏早早过审上市（特别是绿帽子）",2
一直都心心念念的考虑买一台游戏主机，在Xbox、ps4和switch之间犹豫了好久，最后考虑switch有掌机模式和桌面模式，这意味着不用TV也可以开心的游戏。 刚买的时候只能玩马力欧，这段时间又发布了两个游戏，非常及时，好评，随手拿起来就能游戏的感觉比PC好上了太多太多&hellip;&hellip;，单机游戏，想玩就买卡玩，可选择的也多。国行的好歹还有质保，没有那么纠结的。希望以后越来越完善，越来越好。,2
机子很好，朋友推荐的，每天用来跳跳舞，运动运动,2
手感很好，使用灵活，一看就是正品，后面可以多人游戏了。家人很喜欢，希望游戏尽快跟上。,2
给老公的圣诞礼物，抢了个凌晨首发，下午就送到了。从小玩任天堂长大，各种机器基本都入了。家里XBOX One沉睡了很久，看中这个可以在路上玩。纠结很久担心没有游戏，还是咬牙买了。幸好卡带至少都可以。期待更多国行游戏上线。,2
现在国行一片黑暗，后门遥遥无期，游戏过审要半年，强烈不推荐入，来自某位烈士的遗言,1
"产品包装：一如既往的不错。
外形外观：很好，我喜欢灰色的，红蓝的感觉染色有点跳。
流畅度：国行的网络很好，下载游戏和运行都很流畅。
运行速度：运行速度很快，基本上不卡顿。
画面效果：很清晰，画面感很好。
虽然说国行的机子有很大的局限性，开放度比较低，但是我也只是玩玩单机游戏，这个对于我来说足够了。
当然还是希望能多出些游戏，如果也能像日版港版欧美版一样，全共享就好了。",2
能不能靠谱点  腾讯  什么都没准备拿出来卖  和破解版有什么区别  都不能联网  别买了  什么时候能联网你们什么时候买 去买港版,0
买了快一个月了，只有一款游戏，奇葩。,0
非常喜欢这一款啊。昨天半夜下单的，早上就到了的。说实话。买这个就是为了玩健身环的，等着国行健身环快点出来啊。非常好的用，可以和家人一起玩着真的很不错。就是喜欢，国行一样可以玩，对联机没有啥要求。好玩就行,2
"外形外观：喜欢外形
画面效果：真实
流畅度：很流畅
产品包装：正品腾讯包装完美",2
"流畅度：速度很流畅，更新完了，直接体验了预装游戏。下载了数字版马车8。孩子很习惯。
产品包装：包装完整
运行速度：速度很快
外形外观：红蓝主机，外观圆润美观。
画面效果：主机模式可以1080p，画面可以接受",2
忠实3DS玩家，眼馋了好久的switch出国行了，中午看到了不用顶着巨大的延迟登录eshop了，虽然现在游戏还很少，但觉得未来可期，趁老婆对舞力全开产生了兴趣，一举说服把国行主机拿下，借了朋友的卡带两个人在家疯狂尬舞，非常欢乐，主机做工精良色彩鲜艳，总体非常满意，希望大力出游戏，现在只有一个游戏的eshop真的太可怜了，腾讯你敢出游戏我就敢氪金，麻溜的给我搞！shut up and take my money!,2
"画面效果：很清晰，很棒。
运行速度：很流畅，玩游戏不卡顿。
外形外观：包装的很好，目前支持的游戏有点少，希望后面出更多好玩的游戏。",2
"流畅度：非常流畅 挺好的 看看以后游戏多了咋样
运行速度：挺快的
稳定性：目前很稳定
画面效果：画面效果 720P 也就那么回事吧
外形外观：有些大 做工可以
产品包装：还不错 可以很好保护机器",2
"流畅度：简直完美，终于等来了国行，给腾讯点赞。
运行速度：switch简直是新时代掌机
稳定性：很好用，特意买的续航版
画面效果：画面太完美了，没有任何异常
外形外观：简直不要太喜欢，大爱
产品包装：包装完好，而且很大的保护薄膜，
给京东快递点赞，次日达太完美了。刚好赶上搞活动，一如既往支持京东。",2
2000多玩超级玛丽可以的，上午到下午就退货叫我卖二手，真行阿，  不给我退货就举报走正常程序， 描述跟商品不一样欺骗消费者， 这种商家出门就该被车撞死 ，骗人的很差的一次购物体验。,0
"买了一个多月才来评测的，包装很好，物流很快，游戏机本身没有问题，运行很流畅。
唯一的缺点就是国行版本发型两个多月了只有马里奥兄弟这一个游戏，导致我买回来就第一天玩了一会儿，然后吃灰了三天，最后买了非国行版的游戏才又拾起来玩的。
游戏机没有问题。
腾讯对外宣传的那么多游戏都过审了却迟迟不上市，这一点很差劲，腾讯是想劝退潜在的国行switch买家吗？",1
小时候羡慕有掌机的同学，一直希望自己有一台任天堂，现在拿到手了，真的很激动。虽然现在游戏还不多，相信接下来有更多会上线的。,2
国行，垃圾,0
京东很好，腾讯搞毛线，买了两个月了，就一款游戏！,0
非常好玩 可惜游戏少了 希望多增加游戏,2
对哦不关系不错，就是包装有点破了。,1
产品包装：里面连个说明书都没有，只能扫码看怎么连接,1
"外形外观：红蓝经典，时尚大气，操作流畅，结构紧凑设计精巧
画面效果：分辨率高，细节展示丰富
运行速度：运行特别流畅，音效也效果丰富
产品包装：包装简约实用，环保，设计也很有特色
流畅度：一级棒，毫无卡顿，像欣赏一部蓝光电影一样
稳定性：目前运行稳定，没有闪退情况
很棒的商品，强力推荐",2
封条一看都是被拆过的。说什么拆封不退换，那收到就是被拆封了的！无语了！要不是首发，真的怀疑是二手！必须差评！！,0
运行速度：可惜腾讯只有一个游戏我想把它给退了，本来想着会有很多游戏的，谁知道只有一个无聊到爆炸的游戏,1
到现在还是只有一款游戏可买，没有任何的意义，真成了孤儿机,0
买个游戏机没有游戏，只能放家里供着。还不能退款。,0
"真的是最差的一次自营店购物体验
一开始催单居然说配件没有 而那个配件的套餐第二天还在正常开卖 好吧 说谎就说谎 慢就慢点
结果 说好的调货 居然从广州调来 那可是一千多公里外 我选了自营 是要你从那么远运来的？运损概率加倍多少？除了让买家不爽和浪费运送资源 还有什么意义？ 
更搞笑的是 在我之后第二.第三天买的人一天内就到货了 我则要等四天  先买的人却后到。你说没货大家一起等就算了 这区别对待是什么意思 各方面的差评",0
"流畅度：如德芙般丝滑
运行速度：比肩闪电侠
稳定性：目前系统没遇到bug
画面效果：画面质量精美
外形外观：很精致，红蓝CP
产品包装：包装精美，不愧为大厂强强合作
昨晚凌晨买的，今天下午就到了，京东速度很快，买的套餐也很值",2
6月买的收到的是19年的货，客服说不清楚也不给处理，服了。,0
"流畅度：加载速度很快，几乎没有慢的感觉，玩游戏从来不卡顿，神！
运行速度：散热效果好，所以完美运行速度。
稳定性：三种模式随意切换，毫无悬念地无缝对接。
画面效果：屏幕效果满足目前需求，可以更好一些的。
外形外观：一代神机，满分外形。
产品包装：包装简单实用，开箱一股扑面而来的香气！",2
刚开箱发现有划痕真的很不爽换货了，国行勇士们加油！！！！,0
三个月了，就一个游戏，头都顶烂了,0
快递第二天就到了，买了一个游戏玩了一天，无卡顿，不管清晰度和流畅度都非常满意，还有马里奥奥德赛太好玩了,2
不知道为什么只有一个游戏不上架别的游戏，体验感极差，可能是为了这一颗星,0
"太棒了 任天堂最好玩的游戏机 真的好玩?
流畅度：很流畅
外形外观：很好
产品包装：还可以
运行速度：很快
稳定性：很稳定
画面效果：很棒",2
这波首发只有一个国行游戏马里奥U的操作我是很服气的。你哪怕再加一个塞尔达和马里奥奥德赛呢？其实我是比较倾向于这俩游戏买数字版的，因为流程长，随时可以切过去玩一玩。我可以插个异度之刃2的卡带玩然后偶尔切成塞尔达和马里奥换换口味。老是要拔插卡带也太麻烦了。现在国行机器游戏全靠插外服卡带，还没法下载dlc，真是僵硬的一匹。,1
"流畅度：很好
运行速度：顺畅
稳定性：稳定
外形外观：漂亮、很好",2
东西确实不错，国行正品机器，物流也特别快，现在疫情期间估计就京东可以这么快了吧。玩了好几次，游戏也买了不少。,2
太坑了，预约时候还说送个檫镜布，结果货到了就不送了，然后想退货说打开就不支持退货，什么啊！！！！生气,0
拿到手就黑屏，售后客服踢皮球，垃圾的一毛，简直刷新我的三观，售后一个多星期一点消息都没有，问进度一直都是在检测期内，坑的不行，买个东西钱付了，东西还在检测中，需要半个到一个月，没那个实力就别卖这么高端的游戏机，着实丢了国行的脸,0
五一假期刚好有12期免息，昨晚下单今天到真的爽?灰黑色机子比红蓝更耐看，玩外版游戏卡完全没问题。没有在线联机的朋友，真的可以放心入，毕竟比现在的港版日版美版要便宜很多，省下来的钱买几个卡才是真香。,2
"流畅度：流畅度很高，没有可以吐槽的地方。
运行速度：运行速度也很快，但是这里我得吐槽一下，为什么只有一款游戏？广告上没有说明啊，而且总是说游戏数周上，到底需要几个周？
稳定性：稳定，很稳定。在稳定只有一款超级玛丽欧兄弟U。
画面效果：很棒，很清晰。
外形外观：红蓝主机的，不错。
产品包装：包装的很好，没有损坏。",2
"流畅度：游戏操作很流畅，一点不卡顿
运行速度：游戏运行速度很快
稳定性：稳定性良好
画面效果：游戏画面制作精美
外形外观：外观很漂亮，我买的蓝红版，很喜欢
产品包装：包装很严实，一点也没有损坏，盒子还可以用来收纳游戏机相关物件
给游戏机买了马里奥的游戏，找到童年的感觉，已经过了好多关卡了，这关有点难，很赞",2
特别特别差，这也是我见过的最搞笑的产品，整个商店只有一款游戏，真是滑天下之大稽，而且续航不达标，完全达不到9个小时的标准，开机没有开机红，包装简陋，搞不好是被拆过的，当时相信京东所以没注意，现在超级后悔，总之就是一个垃圾,0
产品严重虚假宣传、任天堂游戏机无法使用任天堂旗下游戏产品，该产品提供游戏只有两款游戏并没有任何体感类游戏提供。严重夸大宣传产品，而且该产品严重损害了任天堂产品品牌。请所有任天堂粉丝注意??,0
"轻度玩家，想买很久了，年前就买了卡，一直在家太无聊了就京东买了国行。首先是我在上海从山东跨区调货的，考虑特殊时期还算快的。然后是灰色真的太好看了，我没选错！最后是justdance上头！好玩！
关于国行么，单机玩家轻度玩家和合家欢玩家比较适合，我实在受不了网差，另外考虑到复杂的设置，我一直准备是买国行的。期待健身环大冒险的价格下降吧。我最后悔的就是买的晚了。（腾讯那个贴纸翘角还毫无粘性；送的膜手残也能贴好，获得了很大的满足感）",2
太开心啦，哈哈，心水了好久的switch，终于入手了，虽然很多人都说国行的缺点，但是玩起来还是逃脱不了真香定律啊，价格便宜又有保修，国内网络联机又快，也可以玩其他版本的卡带，非常好，京东送货又快又好，快递小哥服务态度也好。,2
嗯，这个包装的话，因为我买的是好几个，有一个包装纸，盒子有一点点破了，嗯，东西还是挺不错的，玩游戏也挺丰富的，正好这个现在因为这个情况特殊情况，在家里用的蛮多的，嗯，非常好。里面也有好多小朋友可以玩的游戏，正好可以两个人一起玩，嗯，在这个特殊的时间多了很多了，很多可以运动的时间。,2
2000多块买一个游戏 真香 别叫switch旗舰店了 叫马里欧兄弟体验店吧,1
游戏都没几个，很失望,0
第一时间购买了国行，犹豫了很久买啥颜色，灰色比红蓝经看多了。比起港行、日行下载速度很快，运作国际卡一点问题没有。手残党买switch的初衷是健身，目前比较喜欢just dance和fitnes***oxing，期待国行早日出健身环，推荐不玩游戏、又没空去健身房的人买switch,2
研究了各种版本，最好看素素推荐国行的，马上入手了，到货速度非常快，而且相当好，一机三种模式，超期待,2
圣诞节老公给我买的礼物，非常喜欢，画面清晰不卡顿，手柄手感也很好，反应很快，链接到电视机上也很方便，过年放假可以玩起来了，希望国行版多出些游戏啊，特别是健身环大冒险，就是冲着这款游戏买的switch，支持京东哦,2
垃圾 首发买的 今天卖的 一个游戏到现在！逗我 ***,0
垃圾，谁买谁后悔，只有一款数字游戏，身边人都被腾讯骗了，买来吃灰&hellip;,0
不好意思，快递收到没来得及评论。宝贝不错，按照上面的提示一步一步操作，对于第一次上手第一印象感觉不错。很好，现在还在更新，慢慢摸索里面的各项功能,2
就这东西也敢拿出来？？？？？？怕不是个笑话。,0
背后switch标志有划痕  19年的机器有点老了  买完就降价50  也是服气  不愧是***,1
"非常后悔
非常后悔
非常后悔
不要买国行
不要买国行
不要买国行
全服只有一个游戏，任何游戏都不能联网。任何数字版游戏都无法在国行版下载。
请给烈士狠狠点赞",0
5星是给快递小哥的，，对于国产机子大家懂的，，都是勇士，，没啥好说的，，游戏体验极差,0
"这个国行的里面自带了一个马里奥的体验版，关卡不多，无聊的时候可以玩上一会儿。其实我没太搞懂国行和非国行的区别，没有空去研究。平时都是用卡玩游戏，就也感觉还好，而且手上几个游戏都是健身类的，感觉就是一个好玩的健身卡。买了国行，还是觉得有点被阉割
还有就是物流配送，希望以后用正规包装配送，不要一层保鲜膜就给出库，厂商和京东沟通好，不要总是折腾客户",1
下单购买时忘记点选购买保障服务（延保），在其他电子类产品均可以购买补购延保的情况下，这款NS居然无法补购延保，因为是618活动价又无法退货再购。经多次询问店铺客服、在线客服、金融客服均没有给出解决问题的答复。本产品在购买和售后流程中存在漏洞，请店铺和京东官网抓紧修补流程漏洞并将本人存在问题给予及时解决。谢谢！,0
"流畅度：非常好
运行速度：非常好
稳定性：好
画面效果：好
外形外观：喜欢
产品包装：很好",2
经常在这买东西，每次都很满意，足不出户就能买到自己想要的东西，真是太方便了，国行switch现在确实挺勇士的，没啥游戏上架，希望腾讯给力，早日国行上架更多游戏，不奢望独占，联网的早点上线吧，要不然国行太难玩了。,2
"纠结了好久才买的国行ns,现在只有马里奥兄弟一个游戏，现在入国行性价比还是很高的，就等健身环大冒险了，国行加油。",2
不要买国行！！！锁区！！！只有一款游戏，跟承诺的不一样。不如多花100块钱去买港版的！还支持***付款！！！,0
"流畅度：很顺畅
运行速度：很快不卡顿
稳定性：国行啊跟定稳定啦
画面效果：画面惊喜
外形外观：红蓝搭配，和谐
产品包装：保护完好无损",2
感觉挺失望的,1
画面效果：很棒。。觉得还是选国行的放心。。游戏虽然少但是可以买卡玩。。对于我这个游戏小白来说国行很香,2
"稳定性：不想多说啥，第一次给差评！
买回来1个半月，玩了1个月宝可梦盾，抓了200只左右，突然今天黑屏了，怎么也开不了机，充电了也没反应，真的变成一块砖！气啊！",1
"特别棒
好朋友，我都买了
值得拥有
儿时美好的记忆",2
我觉得比日版港版舒服，手感很好，网速很快，希望国行塞尔达和马力欧奥德赛可以马上出来。,2
