comment_sen,score
"流畅度：没毛病，接电视，掌机都很顺畅
运行速度：反应速很好，大游戏开始*载需要等几十秒。
稳定性：游戏过程很稳定，没出现异常。
画面效果：画风以卡通为主，毕竟是掌机。
外形外观：这是重点，轻便小巧，手感很棒
产品包装：红色的外包装，夺人眼球，漂亮
买了三款游戏，一家人玩的很爽，国行外*三年保，相信国行会越来越好。",2
太爽了。一直希望能有一台任天堂。谢谢京东@还有任天堂爸爸成就了我这个梦想啊!新东西股胶味就闻恃别好闻神哈哈。就等行的游戏上线了。看中了好多游戏都还没有国行的版本。爸爸GKD!舞カ全开1塞尔达，宝可梦11赶紧安排上了，真的希望国行游戏越做越好!游戏以后也会有的。现在～上面的水货商贩希望不要再踩国行了。流畅度：完美运行速度：完美稳定性：完美画面效果：完美外形外观：完美产品包装：完美,2
switch是好东西，无奈腾讯是垃圾。这一分是给任天堂和京东快递的。马化腾看不起你。京东物流还是可以的。,0
国行烈士 等到跨年还只有一个游戏 永远的敬请期待 机子还可以 但没有游戏还有什么价值,1
没游戏就算了，竟然玩国外卡带还不能联机，果然*****，要你何用？,0
为了健身换大冒险买了这款游戏机，为了在家运动也是值了，不爱玩游戏就买国行就足够了，老少皆宜，这款游戏设计的太好了，运动量也达到了，在家运动没问题！机器做工也非常细致，配件齐全！开箱也是一种很好的体验！给大家分享一下我的感受，喜爱在家里运动的朋友们买这款游戏机加上健身环游戏超级赞！,2
考虑再三还是买了国行，毕竟方便实惠还有保修，对于只玩单机的我来说相当适合。刚收到就迫不及待的打开了，非常不错，屏幕很清晰，手柄手感也很好，至于游戏体验只有等卡带到了才知道了,2
"流畅度：很流畅
运行速度：很快，比之前玩的3ds快好的
画面效果：很强大，掌机模式下游戏画面精美细腻
稳定性：除了巫师3这样的3A游戏会有跳帧，其他的游戏运行起来很稳定
外形外观：老任的东西都是很玩具的，不错
产品包装：包装一般，但是很环保",2
简直就是忽悠人，国行什么都玩不了，商家还以各种理由不退货退款。,0
国行@啊，啥游戏都玩不了。,1
"流畅度：非常流畅，对于我这种游戏小白够用了
外形外观：很可爱，颜值很高
画面效果：清晰，色彩艳丽，哈哈，这个可能和电视也有点关系
产品包装：非常厚实，就是零件比较多，要检查清楚",2
"早买早优惠早享受，于是早早付定金预定。后头一天出一个新套餐，想补差价升级不行，想退又退不了，找客服全是套话，这波操作真是让人寒心。哎
流畅度：完美
运行速度：完美
稳定性：完美
画面效果：完美
外形外观：完美
产品包装：完美",1
"产品包装：就是盒子上套了个京东快递的袋子，到手发现盒子表面有破损。
建议不要购买国行，首发购买一个月了国行商店只有一个马里奥兄弟，也不像ps4或者Xbox一样有转港服的手段。虽然可以玩外服卡带但是无法使用dlc，没办法完整体验游戏。我买的是游戏机，但是买回来却没有游戏玩，首发时宣传未来数周上架的游戏到了一月底官方没有一点确切消息，后悔当时相信腾讯到手拆封了。",1
没有整体的使用手册，有时候按键指引和实际操作还不一样，怎么按都过不去。操作便利的年代还这么使用不友好，真是少见！,1
本来年前想买日版的，犹豫过后今年却涨到快四千，但是真的想拥有，买国行也是是抱着必死的决心下单的，拿到手之后，只想说真香。游戏小白，买来一是打发时间用，二是想看看大家说的必买游戏到底有多优秀，买的奥德赛套餐，拿到手以后玩到凌晨四点多，又买了旷野之息和死亡细胞的卡带，完美运行，通关之后还能卖出去回血。不过，还是希望国行能审核通过更多游戏！,2
疫情期间终于到手了，操作很简单，期待能多点游戏！,2
10号买的，2199档的送200g闪迪卡没抢到，买了2099，然后转头上新2099档送128g闪迪卡，2199送256g闪迪卡，真**恶心人,0
"买了之后就会后悔，后悔没早买。
以前总觉得日版港版的机器用起来不方便，这次多亏腾讯引进了正品国行版，而且带一年的保修，使用起来也更加放心。包装什么的都不说了，赠品也很丰富，已经开始上手塞尔达传说和超级马里奥了，一下子感觉又回到了童年。
在这个已经成长为大人的残酷世界里，感谢任天堂还能让我们拥有一份九又1/4站台，可以回到小孩子的时代，感受那种最初的快乐。
希望未来会有更多国行版的游戏出现，目前美中不足的是只有一个超级马里奥。",2
"流畅度：70寸电视运行也很流畅，掌机模式就不说了，童年的记忆啊！
运行速度：运行速度很快，放心购买！
稳定性：疫情期间在家都是电视模式一整天，很稳定！
画面效果：画面效果真的很赞！家人都很喜欢，风格也很适合家人一起玩。
外形外观：还是选择相信国行，包装精美，运输给力，因为疫情宅家才决定购买，也很快送到了，JD给力！加油！
产品包装：希望国行switch能越做越好！华硕游戏跟上啊！",2
游戏机只有一款游戏是来搞笑的吗???老子只能玩卡带还不能买dlc，真**不知道为啥要买国行。??腾讯。,0
非常糟糕，机子里面只有一个游戏，完全是废了，最主要的还是不能退货。说拆封就不退，不拆封我就不知道只有一个游戏啊，实在是太坑了，这个钱被骗了。,0
"在购买国行游戏机还是从国外海购游戏机的对比的长时间的过程中，最终购买了国行游戏机。
主要看重国行产品在游戏管理，网络连接，连线游戏以及手游戏机的操控的。对于国内的适配上的独特优势，同时还提供了，非常让人放心的售后服务。
这是国行产品，所具有的最大优势。
游戏机本身已经不需要太多的描绘，很多玩过他的人都知道他的互动交互娱乐等等的优势与强项。
国行游戏机还可以使用游戏卡来驱动游戏，也大大增加了游戏本身的丰富性非常值得购买和体验。",2
"流畅度：非常不错，玩游戏流畅度很高，马里奥豪华版体验版特别好玩呢。
运行速度：很快，反应特别快。
稳定性：稳定性很好，玩起来很舒服。
画面效果：画面效果很棒，色彩柔和。
外形外观：外形外观很漂亮，红蓝手柄，很喜欢。
产品包装：产品包装很用心，很结实，特别让人满意，喜欢！",2
"流畅度：很好
运行速度：很快
稳定性：等以后可以联机
画面效果：很清晰
外形外观：简单大方
产品包装：很结实",2
"很快就到了，晚上下的单，睡到中午起来就到了
运行速度：很快，太快了
产品包装：超喜欢
画面效果： 
外形外观：漂亮",2
下单有说送的布也没送，说好有马车过了一周多还是不出？？？真的不如买日版,0
"流畅度：完全没问题
运行速度：超快
稳定性：很足
画面效果：超高清
外形外观：时尚大方
产品包装：很精致
高端大气上档次！",2
"流畅度：联机效果很好
运行速度：很快
稳定性：稳定
画面效果：任天堂的游戏追求趣味性，画面效果不是最重要的
外形外观：很好看，很便携
产品包装：包装非常严实，没有任何破损，点赞
做为只想放松放松的轻度玩家，国行版正合适，完全够用。其他的外行游戏借同事的卡玩玩单机就行了?，完全满足小白玩家的需求",2
俩月了  就**一个顶蘑菇  我能退了不！！,0
到手进行试玩，很不错，质量有保证，新买的游戏在路上,2
不同服务器，锁服，就一款游戏，都没说明。拆了不能换，明摆着欺诈，只能当单机玩了,0
最近的心头爱，国行版用着很好，我是单机用户，所以不在乎锁服。任天堂很棒，天天夹在转接器上，用电视玩,2
怎么说呢，很不好的一次购物，也怪自己没有了解清楚，国行的任天堂为什么就一个体验版的游戏，其他游戏一个都没有，想玩就得买，一个游戏卡就两三百，真的玩不起啊，相当于买了个板砖一样，真的好后悔，还不能退，简直了,0
国行不出后门，差评不撤。,0
国行，腾讯，马里奥，一年质保。自带超级马里奥兄弟体验版，试玩了一下，运行流畅，载入较快。主机休眠以及唤醒都很快速&hellip;&hellip;期待更多游戏。,2
卖家真的不厚道，10号前预约购买，11号就出了更优惠的套餐，这预约有毛意义,0
"收到机子还是很激动的，看了好久了，终于出国行版了，于是马上就买了。感觉不错希望出更多更好玩的游戏，也希望能和家人朋友一起玩。
流畅度：不卡顿
运行速度：较快
稳定性：良好
画面效果：非常棒
外形外观：屏幕比较大
产品包装：好",2
游戏可以说没有，除了一个马里奥兄弟，还是期待腾讯下一步动作。。希望能给玩家跟多惊喜,1
**！liar！大家千万别上当，去看看差评里面的遭遇，这款游戏只能玩一款游戏。而且产品说明没有任何警示！就好比你买回来一台电视只能看新闻联播。真是欲哭无泪！这是我京东购物最糟心的一次经历，没有之一！,0
千万不要买，花两千多就是买了一个只有一个游戏的马里奥的单机设备。客服在你购买之前也不会会让你说明，很含糊的让你以为e商店可以购买更多游戏，结果里面就只有一个马里奥，别的什么都没有。当你买了再次找到客服时，他们会给你画个大饼，说将来会上线的。既然将来会上线，那是不是可以把钱退给我，等将来上线了我再付全款，我花了钱更本没有享受到该有的娱乐体验。,0
买台机子，我能被气死，买到没多久，手柄操作没反应或者反应过度，好不容易申请换新了，结果，说我下单的时候没选到6期免息支付方式，因为选了另外一个优惠立减，给我减了0.01元，当时就是因为6期免息才买的好么，真坑，购买体验真心差,0
一打开包装内包装就是被拆过的，这是直接断人家后路啊！7天无理由就是个笑话，产品先不说，这点就让人很不爽了。一直想要一台游戏机，国行ns是我的第一台，纯粹是支持，希望国内游戏环境越来越好，更加开放，&ldquo;国行烈士&rdquo;不希望真的应验，只能说未来可期吧！,1
就一个游戏，连不了外网,0
"流畅度：非常好玩！
这次引进国行有一说一我还是挺高兴的，这毕竟是我们在游戏机产业上迈出了一步，高兴腾讯能代理这个东西，虽然现在商店里只是有一个游戏，但是并没有锁区，你还可以用其他的游戏卡来玩，我买并不是为了玩这么大做的DLC，也就是风花雪月和打打健身环，自己到手以后还买了国航的底座和国行的pro游戏手柄。这些游戏够玩非常长一段时间了，我觉得是这个游戏机最大的好处就是它能让你和你的朋友一起欢乐的分享这个时光，在这段时间不能出门的时候可以体会到更多合家欢的游戏。和我的家人一起玩马里奥一起跑赛车，觉得非常的开心，还是那句话，任天堂是世界的主宰。最后再表扬一下京东，京东作为首批预定的发货非常的快，特别是那个套餐还是挺划算的，里面那个包非常的棒，而且还有一张非常大内存的内存卡。就是腾讯要加紧引入游戏了，这么大个内存卡不用的话多浪费呀，还有非常期待之后的新作，我原本的卡都有了，就等你们赶紧出这三张的国行了。也希望之后国行游戏越来越多，越做越好，让我们真正和世界的玩家一些体会到游戏的乐趣。",2
说实话我后悔买国行了，其他版本的难道不香吗？,1
看视频会卡 运行速度有点慢，机子的电流声也很大,0
"流畅度：非常完美，我用国行我自豪，就是游戏少
运行速度：还行不错
稳定性：可以运行梦见岛
外形外观：玲珑漂亮
画面效果：非常可以
产品包装：京东大箱子，完美包装，不错！",2
"就一个塑料袋包起。然后盒子被压变形。铝盒也被压变形。只能退货。
京东快递你是来制造废品吗？我能理解贴吧那些没有封条的哪里来的了。",0
"流畅度：很流畅，效果杠杠的，超级满意，物有所值哟。
运行速度：运行速度相当快，很满意，不卡顿。
稳定性：稳定性还可以，有待后续观察。
画面效果：画面效果经典，大气。满意
外形外观：外观没得说，特别经典。颜色好看！
产品包装：包装还可以吧。纸箱子运输，外面略有
有点损坏，可以接受",2
机子可以，不错，但是发的游戏盒子坏了，心情很不爽！京东自营的都能这样！,0
辣鸡国行，装死第一，不出游戏另一码事，差评给态度,0
年陪孩子观看游戏视频时偶然看到了奥德赛游戏的介绍，当时一大一小就被吸引住了，可惜那时游戏主机还没国行。终于等到国行上市，又正好赶上双十二，马上下手。到货后按照说明进行首次配置，非常简便，说明也相当于Switch真可谓是家庭成员各取所需，老婆爱玩体感游戏，孩子喜欢卡通风格的马里奥，我自己则是老滚5和真人快打，虽然还是接到大屏电视上爽，但手里拿着也很方便，随时随地可以娱乐一下，就是好几次地铁都坐过站了新手教学，告诉如何使用主机。主机系统流畅，画面精细，手持模式也能很过瘾的畅玩，这下真是方便极了。现在就等目前唯一的游戏卡带到货了，体验版只能看不能玩啊啊啊&hellip;另外，奥德赛啥时候上市啊，等上市后，XBOX估计要冷藏一段时间了。,2
很好，非常满意，只玩单机和家人一起玩游戏非常合适,2
少了一块布，说两到三天答复，然后就没有然后了。。。。,0
就能玩一个游戏 一个月了 就一个游戏,0
垃圾国行switch,0
"期待已久的游戏机，拿到手非常惊喜，做工精致，设计精美，支持国行，虽然游戏只有一个，相信将来一定有大市场，买国行，支持国服游戏！希望越做越好！
流畅度：流畅度：",2
"流畅度：游戏玩起来很流畅，没有卡顿
运行速度：运行速度也很快，游戏开的很快
画面效果：游戏机上玩也很清楚， 在电视上玩画面非常棒
产品包装：包装非常好，很牢固",2
"流畅度：掌机模式和电视模式下游戏运行流畅，没有发现卡顿
运行速度：运行稳定，游戏时间也比老版本的机器长
画面效果：画面效果见仁见智，老仁家的游戏本来就不是以画面效果见长
外形外观：ns的三种模式很有创意，特别适合聚会玩
需要吐槽的就是国行游戏了，只要299就能清空eshop商店，太让人失望",2
发货神速，送了套装，接上了投影仪使用，颜色很鲜艳，音效也很好，玩了超级玛丽体验版很有意思，就是现在游戏太少了，希望能尽快引进塞尔达等大作，非常期待，希望是实体卡，价格优惠一点，最希望赶快引入健身圈大冒险，特别期待，想用这个健身，其它版本的太贵了，希望给力一把，还有有氧拳击，游戏健身两不误，期待啊，还有就是国内网友联机功能，加快进度开发吧，加油,2
还行,1
整体都好，就是只能玩一个游戏。花了2000买来的卡，全都无法联网，基本钱都白花了。,1
很不错，感觉还是国行有保证一些，用起来很流畅，经典的马里奥游戏大爱,2
新游戏出的太慢了，官网也没啥动静，买了个机子玩了1个月马里奥就吃灰了，感觉还要好久才会出下一个游戏，如果有选择的话还是港版吧。,0
"买的比较晚，今天刚收到。拿到还是很惊艳的，现在正在更新主机，感觉物超所值，有主机，手柄，握把，底座，腕带配件太多了，坐等塞尔达了。
外形外观：很漂亮
流畅度：很流畅
画面效果：比想象的72*p要好得多，挺清晰的。
产品包装：不错不错，很大一个箱子。
运行速度：不错
稳定性：不错",2
春节前买的机卡套装，可以手持，可以接电视，可以单人，可以双人，经典的超级玛丽，大人小孩子都很喜欢。,2
心心念念的等着国行！开售当天，老公就下单了，京东的自营的快递没得说，开心，当天下午快递?就到家，当天还去买了游戏卡，立马充电，开机、装卡(风花雪月)，里面自带了新超级玛丽的体验版，迫不及待的先玩了几局?！,2
机器做工很一般，2个人玩的时候，右手柄方向键和按键很近，很容易碰到R，L键，严重设计缺陷，掉电速度快，买了游戏机，游戏还拖好几天发货，前一天买了，第二天又做活动，买的时候问客服双12会有优惠吗，客服隐瞒消费者，说没收到通知，太伤心了，打开包装还不能退了，说心里话，玩了体验版的马里奥兄弟后游戏感觉真一般，还不如wii上的马里奥兄弟，还不能退，大家买之前看一下我的经历和感受再买，我从小就玩任天堂游戏机，这次买机器到使用感受是最差的,0
"运行速度：不错，满意
画面效果：机器上看着一般，但连接电视后效果就很好了，很满意，清晰
外形外观：漂亮，值这个价格
流畅度：赶紧引进游戏，要不再流畅有什么用",2
售后服务极差，退货速度极慢，慎买！！,0
"流畅度：目前只玩了三个游戏，马车八，塞尔达和舞力全开，流畅度非常好，给家人带来了很多欢乐。
运行速度：马车八和塞尔达运行良好
稳定性：稳定，但是存在发热现象
画面效果：老任什么时候在画面效果上赢过？（手动捂脸哭）
外形外观：独一无二的外观，一眼就知道是它是它就是它
产品包装：包装的边角有磕碰，还有很大的进步空间。",2
就只有一个游戏 不知道什么时候游戏才能上 一点消息也没有,1
为什么差评都懂得。只能说腾讯**,0
不得不说，京东618活动真的很给力，分期付款，让很多想拥有的东西买得一点压力都没有，switch分期24个月，一个月少喝3杯奶茶，太容易了，快递速度很快，很赞，小哥哥也很负责，看着不是本人还打电话确认，很负责。,2
略坑,1
"流畅度：开机很流畅，全中文界面 不用折腾
外形外观：成色做工都很好  比lite版大很多 但是携带也很方便
产品包装：国行专属包装 有专属封条 京东单位快递很给力 没有破损
运行速度：试玩版运行无压力 就是游戏有点难
稳定性：很稳定 没有BUG
画面效果：很精致 超出了预期 很满意",2
"流畅度：很好，期待了很久，618终于下手了，流畅度很顺滑，和家里人玩得很开心。
画面效果：画面效果比上一代主机好太多了，爱了。
外形外观：冲着红蓝配色买的，外观很喜欢，很精致
稳定性：稳定性很好，因为游戏会为平台优化，所以玩的时候很稳定。",2
索尼大法港服玩家一枚，这个是买来给妹子玩的，健身环已经在路上，奥德赛真是好玩到爆，游戏细节做的很用心，处处有惊喜。618秒杀勇当国行勇士，1648还要啥自行车，希望国行游戏审核速度能跟上，不然其他游戏只能~买卡了,2
"画面效果：不要买国行！
流畅度：不要买国行！
运行速度：不要买国行！
稳定性：不要买国行！
外形外观：不要买国行！
产品包装：不要买国行！",0
国行就是个废物，不要买不要买不要买！,0
对比犹豫了好久买了国行版本的，京东物流很快，第二天就到了，拿到以后试了试，没有什么问题，运行速度很快，画面效果也很好，没有什么卡顿，稳定性很强，游戏的话要单独买游戏卡，不过价格也还好，可以接受，还可以和电视连接，很喜欢，好评。,2
"流畅度：特别快。没有卡顿。下载速度特别快
运行速度：没出现卡顿。流畅度高，主要现在就一款游戏。等后续吧。
稳定性：没有出现过闪退。网络稳定
画面效果：画面清晰。很好高清。画面流畅度很高，没有卡顿。
外形外观：大小合适。不累手。主要一年保修不香吗。
产品包装：外包装精美。",2
"流畅度：德芙般丝滑
运行速度：长征七号般速度
稳定性：只要不摔挺稳定的
画面效果：高清**
外形外观：香
产品包装：京东物流值得信赖
然后这里讲一下国行，相信之后越来越好，游戏越来越多，腾讯代理，就算，就算以后能在上面打吃鸡打王者，感觉，更舒服不是嘛，哈哈，摇杆真香",2
"流畅度：流畅度和别的版本一样
运行速度：很顺畅无卡顿
稳定性：稳得一批
画面效果：画面非常好
外形外观：非常酷，我终于有自己的switch了
产品包装：酷",2
游戏机没有游戏玩叫什么游戏机，我都不要求原价退货居然还不让退,0
"产品包装：封条没有封着被打开过，不过机子没啥问题。
外形外观：不错，就是右边手柄有点小晃动，问题不太大。",1
很有感觉，孩子2岁，还不会玩，和老婆玩得很高兴，本来是小儿子买的，第一时间下载，画面清晰，机子很漂亮，全新，无各种问题，最主要的是价格，京东会用这么多，只要2348，应该比较值了，包十200G卡十马8，虽然游戏是数字的，本打算只买实体卡的,2
"顶蘑菇模拟器，好几个月了还是一个游戏，真不愧是你?
一星还是看在能插卡玩塞尔达",0
买了快三个月了，还是只有一款游戏，腾讯，牛！,0
之前在欧洲买了个，商店很多游戏 还有免费的，这个国服版商店就一个游戏 ，switch本来游戏就没多少 国服太让我失望了。这台给女朋友玩 不知道能坚持多久吃灰,1
非常好，这个假期终于不无聊了,2
"流畅度：单机，联机运行都很流畅
运行速度：很好
稳定性：好
画面效果：电视画面非常棒
外形外观：好
产品包装：好
都说是国行烈士，其实我觉得东西很好，很适合和家人孩子一起玩，游戏画面也很Q很有想象力，外行卡带运行没有问题！",2
游戏机这种东西是我们小时候玩的东西，已经很久没有玩这种陶萍的电脑游戏了，就算是平时玩玩的小游戏，也是在手机上玩一玩罢了，第1次在网上买有心机，没想到京东物流非常快。下单以后基本上第2天就送到了，已经装备好了，孩子们已经玩上了，游戏运行速度非常快，头评大不伤眼睛，非常不错。,2
游戏什么时候出,1
居然买了国行,1
"流畅度：非常流畅 非常的棒
运行速度：非常的快 没有任何卡顿
稳定性：非常稳定 我买来一直开机很多天了 稳定性非常好
画面效果：挺满意的.1080p看起来已经很清晰了.不比2k逊色太多
外形外观：太好看了 红蓝配色.我爱死了
产品包装：非常精美 唯一的缺点就是.游戏就一个，希望国行游戏快快过审.我想玩网球和马车8",2
只有马里奥，我一点也不喜欢马里奥，呵呵。tx长点心吧，别把好牌打烂了。当然，除了游戏，其他挺香的。,1
非常差，内容极少不说明清楚，购买够明明写着七天无理由退货，却不给退货。欺骗用户，难以忍受,0
"买的游戏套餐，没收到游戏。
就这样。",0
国行烈士没游戏玩@,0
产品包装：这包装也太简单了吧！购买的套装，就用一个破袋子装，京东用不起纸盒了吗？游戏机盒子已经破损了，正不敢想象它一路经历了什么，还好开机试了试没有什么问题。,1
**国行，很多游戏都玩不了，还不给退货！要买的看清楚不要贪小便宜，国行很多玩不了,0
"首先京东自营物流还是很给力的，跨区调货江苏送到江西，从下单到手上24小时不到。
国行 家庭娱乐首选，女儿5岁半，就周末陪她玩马车8和派对，很快乐，作为80后的我也是玩着红白机的超级玛丽长大的！
我喜欢灰色手柄，耐包浆，耐盘，耐看。粉红加绿手柄女儿钦点的。
游戏我都买的是卡带，不考虑回血，只是单纯的怀念小时候，换卡玩游戏的快乐。
最后希望国行加油！",2
买这东西可以戒游戏，太神奇了。,0
包装一个角有破损. 并且.第一天卖和第二天卖完全两个待遇？ 第一天买的没卡 第二天有卡？ 这么做事不合适吧？差评,1
之前看宣传说数周发布新游戏，结果到手了半天，还是敬请期待。蘑菇都顶成金针菇了。第一次买东西给差评～,0
